
1,20280203,MAS ABDOELLAH BASTARI,Komplek PT. Abbas Agri,Batulawang,SWASTA
2,20276103,MAS AL-RIYADL,Jl. Pasir Kampung Kp. Loji Al-Riyadl Rt.03 Rw.18,Cipanas,SWASTA
3,20280221,MAS ASSA IDIYYAH,Raya Cipanas No. 100/12,Sindanglaya,SWASTA
4,60707584,MIS AN-NUR,Kampung. Gebeo RT.01 Rw 12,Cipanas,SWASTA
5,60707585,MIS ASSAIDIYYAH,Jl. Raya Cipanas No. 100/2,-,SWASTA
6,60707586,MIS FUTUUHIYAH,Jl. Cilengsar No. 10 Cipanas,Cipanas,SWASTA
7,60707587,MIS MIFTAHUL FALAH,Kp. Kubang Rt.03/09,Sindangjaya,SWASTA
8,60707588,MIS MIFTAHUL ULUM,Kp. Padarincang,-,SWASTA
9,60707589,MIS RAUDLATUL ULUM,Kp. Sindangsari RT. 03/11,CIPANAS,SWASTA
10,69927500,MISAhmad Dahlan,Kp. Babakan Cisarua RT 03 RW 13,Sindanglaya,SWASTA
11,20277983,MTSS ABDOELLAH BASTARI,"Jl. Perkebunan Ciseureh, Komplek Pt Abbas Agri, Kp. Merdika Rt 01/rw 07",-,SWASTA
12,20277980,MTSS AL-RIYADL,Kp. Loji Al-Riyadl Rt. 03 Rw. 18,Cipanas,SWASTA
13,20277981,MTSS ASSA IDDIYYAH,Jl. Raya Cipanas Kampung Neglasari RT/RW. 02/04  Desa Cipanas Kecamatan Cipanas,Cipanas,SWASTA
14,20277982,MTSS FUTUUHIYAH,Jl. Cilengsar 10 Desa Cipanas Rt 002/014,-,SWASTA
15,20277984,MTSS SA MIFTAHUL FALAH,Kp.kubang Rt.03/09,Cimacan,SWASTA
16,20204301,SD MARDI WALUYA,Jl Raya Sindanglaya,Sindangjaya,SWASTA
17,20203388,SD NEGERI  SINDANGLAYA,KP. PAKALONGAN DS SINDANGJAYA KEC.CIPANAS - CIANJUR,SINDANGJAYA,NEGERI
18,20204265,SD NEGERI BINA KARYA,Jl. Pasir kampung no d.22,CIPANAS,NEGERI
19,20204264,SD NEGERI BINABUDI,Jl Pasir Kampung,Cipanas,NEGERI
20,20205011,SD NEGERI CIKOLE,JL. SIGUNTANG KP. CIKOLE,BATULAWANG,NEGERI
21,20204940,SD NEGERI CILOTO,Kp Jemprak,Ciloto,NEGERI
22,20204941,SD NEGERI CIMACAN 1,Jl Raya Cimacan No 29,Palasari,NEGERI
23,20204942,SD NEGERI CIMACAN 2,Jl. kebun raya cibodas  No.30,Cimacan,NEGERI
24,20204931,SD NEGERI CIMACAN 3,Jl. Kebun Raya Cibodas No. 35,Cimacan,NEGERI
25,20204946,SD NEGERI CINYAWAR,Jl Raya Puncak Kp. Cinyawar,Ciloto,NEGERI
26,20204950,SD NEGERI CIPANAS 1,Jl Mariwati No 9/11 Cipanas,SINDANGLAYA,NEGERI
27,20204951,SD NEGERI CIPANAS 2,Jl Pasir Kampung No 34 Pasekon,Cipanas,NEGERI
28,20204952,SD NEGERI CIPANAS 3,Jl Mariwati No.9 Rt 01 Rw 01,Sindanglaya,NEGERI
29,20204953,SD NEGERI CIPANAS 4,Jl. Pasir Kampung No. 1,Cipanas,NEGERI
30,20204684,SD NEGERI CISEUREUH,JL PERKEBUNAN CISEUREUH,Batulawang,NEGERI
31,20204591,SD NEGERI DEWI SARTIKA,Jl Smpn 1 Cipanas Kp Tugaran,SINDANGLAYA,NEGERI
32,20204620,SD NEGERI GIRI MUKTI,Jl Kebun Raya Cibodas,CIMACAN,NEGERI
33,20204774,SD NEGERI GUNUNG BATU,Jl Gunung Batu,Sindangjaya,NEGERI
34,20204706,SD NEGERI JAYAGIRI,Jl Kebun Raya Cibodas,CIMACAN,NEGERI
35,20203533,SD NEGERI KARYA BHAKTI,"Jl. Kayumanis No. 110, Kp Sindangsari",CIPANAS,NEGERI
36,20203514,SD NEGERI LOJI,"JL. PERKEBUNAN CISEUREUH, LOJI",Batulawang,NEGERI
37,20203504,SD NEGERI LOKASARI,Jl. Mariwati No. 9-11,Sindanglaya,NEGERI
38,20203674,SD NEGERI MEKARSARI,Jl Raya Hanjawar Kp Coolibah,cimacan,NEGERI
39,20203601,SD NEGERI MITRA BHAKTI,"Kp Bengkok, Rt 01/11",Sindanglaya,NEGERI
40,20203629,SD NEGERI NEGLASARI,Neglasari,BATULAWANG,NEGERI
41,20203617,SD NEGERI NUSA INDAH,Jl Jeprah,PALASARI,NEGERI
42,20203319,SD NEGERI PALASARI,Kp Geduk,PALASARI,NEGERI
43,20203277,SD NEGERI PUNCAK 1,Jl Puncak Ciloto,CILOTO,NEGERI
44,20203266,SD NEGERI PUNCAK 2,Jl Rya Puncak Ciloto,CILOTO,NEGERI
45,20203413,SD NEGERI RARAHAN,Jl Kebun Raya Cibodas,CIMACAN,NEGERI
46,20203387,SD NEGERI SINDANGLAKA,"Jl. Perkebunan Ciseureuh, Kp. Sindanglaka",Batulawang,NEGERI
47,20203368,SD NEGERI SINDANGSARI,Jl. Perk. Teh Ciseureuh Ds. Batulawang,Batulawang,NEGERI
48,20204107,SD NEGERI SUKASARANA,Jl.Sukasari No12.d,Sindanglaya,NEGERI
49,20204070,SD NEGERI SURYAKANCANA,Kp Pakalongan,SINDANGJAYA,NEGERI
50,20203767,SD NEGERI TARIGU,Jl Mariwati,SINDANGLAYA,NEGERI
51,20203752,SD NEGERI TEGALLEGA 1,Kp Tegallega,PALASARI,NEGERI
52,20203749,SD NEGERI TEGALLEGA 2,Jl Bukit Danau Kp Tegallega,PALASARI,NEGERI
53,20203794,SD NEGERI TRIKARYA,"Jl. Agropolitan, Kp. Jolok",Sindangjaya,NEGERI
54,20252168,SD SWASTA HARAPAN KASIH BANGSA,Jl Mariwati,Sindanglaya,SWASTA
55,69883632,SDIT MAKIYA,KP BALAKANG RT 01/08 DS SINDANGLAYA,SINDANGLAYA,SWASTA
56,69945126,SMA PLUS SIROJUSSYAFIIYYAH,Jl. Kemang Kp. Cihurang Rt/Rw 03/07,Sindangjaya,SWASTA
57,69786347,SMAS ISLAMIC AL-IRSYAD BOARDING SCHOOL,Jl. TK Yamin No.1 Padarincang,Palasari,SWASTA
58,20203719,SMAS MUHAMADIYAH CIPANAS,JL. SUKASARI NO. 47,SINDANGLAYA,SWASTA
59,20203735,SMAS PGRI CIPANAS,Jl. Pahlawan Landbow Sindanglaya,Sindanglaya,SWASTA
60,69894018,SMK AL-IRSYAD CIPANAS,JLN TK YAMIN NO 1 PADARINCANG,Palasari,SWASTA
61,20252398,SMK NEGERI 1 CIPANAS,Jl. Raya Cipanas,Cimacan,NEGERI
62,69895908,SMK NUSA BANGSA,Jln. PUNCAK DUA PERKEBUNAN TEH CISEUREUH,Batulawang,SWASTA
63,69956533,SMK SUFFAH AL HAFIIZ,Kp. Ciketug Ds. Sindangjaya,Sindangjaya,SWASTA
64,20252872,SMKS FUTUUHIYAH,JL. CILENGSAR NO.10,Cipanas,SWASTA
65,20252045,SMKS IPPS CIPANAS CIANJUR,JLN. PASIR KAMPUNG. PASEKON NO. D13 CIPANAS - CIANJUR,Cipanas,SWASTA
66,20252875,SMKS KARISMA,BUKIT DANAU,PALASARI,SWASTA
67,69727436,SMKS SINAR PARAHYANGAN,JL MARIWATI KP BALAKANG NO 111 CIPANAS,Sindanglaya,SWASTA
68,69852115,SMKS TAZKIA NUSANTARA CIPANAS,JL KEBUN RAYA CIBODAS KP BABAKAN CIKALONG DS CIMACAN KEC CIPANAS,Cimacan,SWASTA
69,69858470,SMP HARAPAN KASIH BANGSA,JL MARIWATI KP JEPRAH KEC CIPANAS,Sindanglaya,SWASTA
70,69922107,SMP ISLAM AL-HUSNA MADANI,Jalan Perkebunan Ciseureuh Rt 01 Rw 01 Desa Batulawang,Batulawang,SWASTA
71,69761725,SMP ISLAM SIROJUSSYAFIIYYAH,Kp Cihurang Rt. 03/07 Desa Sindangjaya Kecamatan Cipanas Kababupaten Cianjur,Sindangjaya,SWASTA
72,69894541,SMP ISLAMIC CENTRE MUHAMMADIYAH,JL CILENGSAR No 10 RT 02/14 BABAKAN SIRNASARI,Cipanas,SWASTA
73,69981910,SMP IT AL-ANWARIYYAH,Kp. Cikole RT. 03 RW. 03,Batulawang,SWASTA
74,20252023,SMP NEGERI 1 CIPANAS,Jl. SMP No. 67,Sindanglaya,NEGERI
75,20203812,SMP NEGERI 2 CIPANAS,JL. BUKIT DANAU TEGALLEGA,PALASARI,NEGERI
76,60733360,SMP NEGERI 3 CIPANAS,Cipanas,Batulawang,NEGERI
77,20203860,SMP S BINA UTAMA,Jl. Kebun Raya Cibodas,Cimacan,SWASTA
78,20203866,SMP S MARDI YUANA CIPANAS,Jl. Raya Cipanas,SINDANGJAYA,SWASTA
79,20203868,SMP S MUHAMMADIYAH CIPANAS,Kp.sukasari No.47 Cipanas,SINDANGLAYA,SWASTA
80,20203901,SMP S PGRI CIPANAS,Cipanas Cianjur,Sindanglaya,SWASTA
81,20255289,SMP S RAUDATUL ULUM,Jl. Sindangsari No.6,Cipanas,SWASTA
82,20252977,SMP S TERPADU MIFTAHUL ULUM,Kp.Padarincang Rt. 03 Rw. 03,Palasari,SWASTA
83,69969762,SMP TUNAS TARUNA JAYA,Kp. Kemang RT. 03 RW. 06,Sindangjaya,SWASTA
