
1,69726469,MAS AZ ZAHRA,Jl.raya Ciapus No.05 Rt.03 Rw.01,Sukamakmur,SWASTA
2,20280139,MAS DARUL IHYA,Kp.laladon Sukajaya Rt 01/02,-,SWASTA
3,20280150,MAS INSAN TAQWA,Jl. Raya Kota Batu - Ciapus No. 190 Rt 01/15,-,SWASTA
4,20276325,MAS PPIQ,Jl. Perum Bukit Asri Rt. 03 Rw 02,Pagelaran,SWASTA
5,60706677,MIS AL AWALIYAH,Kp.Padurenan RT 03 RW.03,-,SWASTA
6,60706765,MIS AL FURQON,Kp.Sawah Ilir Ds.Mekarjaya,-,SWASTA
7,60706766,MIS AL HASANAH,Jl. Ciapus Sukamakmur No 05,-,SWASTA
8,60706767,MIS AL INAYAH,Kp.Babakan RT 02 RW 03 Ciomas Ds.Parakan,Parakan,SWASTA
9,60706768,MIS ANWARUL HIDAYAH,Kp.Laladon kadoya RT 01/05 Ds.Parakan,Parakan,SWASTA
10,60706769,MIS ARRAFIIYAH,Jl.PAM Ciburial - Sinarmulya RT. 02 RW. 05,Ciomas,SWASTA
11,60706770,MIS DARUL IHYA,Kp.Lalaldon RT 02 RW 02,Ciomas,SWASTA
12,60706774,MIS IBNU AQIL,Jl.Raya Laladon No.256,-,SWASTA
13,60706771,MIS INSAN TAKWA,Jl.Raya Kota Batu No.190 Ds.Kota batu,-,SWASTA
14,60706772,MIS NASYATUL ISLAMIYAH,Kp.Laladon RT. 2 RW. 10,Pagelaran,SWASTA
15,60706773,MIS TARBIYATUL ATHFAL,Kp.Ciapus No.21 RT. 05/04 Ds.Sukamakmur,-,SWASTA
16,20277480,MTSS AL HASANAH,Jl. Raya Ciapus No.05  Rt.03/01,Sukamakmur,SWASTA
17,20277481,MTSS AL INAYAH,Jl. H. Abdullah No.1 Babakan Ciomas RT. 002/003,Parakan,SWASTA
18,20277487,MTSS ANWARUL HIDAYAH,Kp. Laladon Kadoya Rt 01/05,Parakan,SWASTA
19,20277482,MTSS AR RAFI IYAH,Jl. Pam Ciburial - Sinarmulya Rt. 02 Rw. 05 No.46,-,SWASTA
20,20277483,MTSS DARUL IHYA,Kp. Pagelaran Rt. 001/004,-,SWASTA
21,20277485,MTSS INSAN TAQWA,Jl. Raya Kapten Yusuf No. 190,-,SWASTA
22,20277486,MTSS P P I Q .,Jl. Perum Bukit Asri Rt 03 Rw 02,Ciomas,SWASTA
23,20280558,MTSS RAUDLATUL ULUM,Kp. Kaum Pandak Rt.04/02,-,SWASTA
24,69956401,Muadalah Darussalam,Padasuka,-,SWASTA
25,69956417,Muadalah Darussalam,RT.01/02,Padasuka,SWASTA
26,20253276,SD IT KAIFA,Perum Bukit Asri Ciomas Blok C 19-21,Pagelaran,SWASTA
27,20201432,SD N CIAPUS 01,Jl Ciapus Suka Makmur,SUKA MAKMUR,NEGERI
28,20201433,SD N CIAPUS 02,Jln. Raya Cibinong  Rt 02  Rw 02,CIAPUS,NEGERI
29,20230436,SD N CIAPUS 03,Kp Cipayung Rt 03/ 05,SUKAHARJA,NEGERI
30,20230437,SD N CIAPUS 04,Jl Ciapus Peuntas Rt04/03,SUKAMAKMUR,NEGERI
31,20201423,SD N CIAPUS 05,Jln. Ciherang Cutak,Ciapus,NEGERI
32,20201421,SD N CIAPUS 07,Jl Ciherang Cutak,CIAPUS,NEGERI
33,20201411,SD N CIAPUS 08,Ciapus Sukamakmur,SUKAMAKMUR,NEGERI
34,20201792,SD N CIOMAS 02,Jl Ciomas Kreteg,CIOMAS RAHAYU,NEGERI
35,20201806,SD N CIOMAS 03,JL. RAYA CIOMAS Gg. SALEH RT 01 RW 05,PADASUKA,NEGERI
36,20230482,SD N CIOMAS 04,Jl Raya Ciomas Gang Sadar,Ciomas Rahayu,NEGERI
37,20230483,SD N CIOMAS 05,Jl Pam Ciburial,PAGELARAN,NEGERI
38,20201702,SD N CIOMAS 06,Kp. Kreteg  Rt 04  Rw 03,PADASUKA,NEGERI
39,20201716,SD N CIOMAS 07,Kp Duren Rt 04/06,CIOMAS,NEGERI
40,20230484,SD N CIOMAS 09,Kp Duren Rt04 Rw06,Ciomas,NEGERI
41,20230480,SD N CIOMAS 1,Jl. Ciomas Kreteg,Ciomas Rahayu,NEGERI
42,20201620,SD N KOTABATU 01,Kapt. Yusup  No.1,KOTABATU,NEGERI
43,20201621,SD N KOTABATU 02,Jln Kapten Yusuf No 3,Kota Batu,NEGERI
44,20230541,SD N KOTABATU 03,Jl Asrama Badak Putih 1,KOTA BATU,NEGERI
45,20201636,SD N KOTABATU 04,Jl N Kapten Yusuf 23,KOTA BATU,NEGERI
46,20201637,SD N KOTABATU 05,Jl Kapten Yusuf No 68,KOTABATU,NEGERI
47,20230542,SD N KOTABATU 06,Jalan Asrama Badak Putih I,Kotabatu,NEGERI
48,20201622,SD N KOTABATU 07,Jalan Asrama Badak Putih 01,Kota Batu,NEGERI
49,20201638,SD N KOTABATU 09,Jl Kapten Yusup No 23,KOTABATU,NEGERI
50,20201633,SD N LALADON 01,Kp. Bubulak RT.001/009,Laladon,NEGERI
51,20230544,SD N LALADON 03,Jl. Raya Laladon RT 04 RW 01,Laladon,NEGERI
52,20200510,SD N PAGELARAN 01,Jln. Kreteg  Rt 02 Rw 02,PADASUKA,NEGERI
53,20200511,SD N PAGELARAN 02,Jl. Kreteg,PADASUKA,NEGERI
54,20230559,SD N PAGELARAN 04,JL. Pam Ciburial Kp. Sirnasari,Pagelaran,NEGERI
55,20200437,SD N PARAKAN 02,Jl H Abdullah No 11 Rt 03/03,Mekarjaya,NEGERI
56,20200453,SD N PARAKAN 04,Jl H Abdullah,MEKARJAYA,NEGERI
57,20200824,SD N SUKAMAKMUR,Jln Ciapus Sukamakmur Rt 02/02,SUKAMAKMUR,NEGERI
58,20201422,SD NEGERI CIAPUS 06,Jl Cibinong,Sukaharja,NEGERI
59,20201717,SD NEGERI CIOMAS 08,Jalan Raya Ciomas Kreteg,Ciomas Rahayu,NEGERI
60,20230543,SD NEGERI KOTABATU 08,Jl Kapten Yusuf  No 27,Kota Batu,NEGERI
61,20200512,SD NEGERI PAGELARAN 03,Jln. Pam Ciburial  Rt 01  Rw 04,PAGELARAN,NEGERI
62,20200436,SD NEGERI PARAKAN 01,Jalan H. Abdullah,Parakan,NEGERI
63,20200452,SD NEGERI PARAKAN 03,Jl. Pahlawan Kp. Silih Asih RT. 02 RW. 01,Parakan,NEGERI
64,20230630,SD S AN - NUR,Kp. Baru  Rt 02  Rw 12,CIAPUS,SWASTA
65,20253570,SD S AROFAH,Jl. Raya Ciomas Permai No. 9 Kec.Ciomas,Pagelaran,SWASTA
66,20201623,SDN LALADON 02,Kp Laladon Gede Rt04/03,LALADON,NEGERI
67,20200792,SDN TAMAN PAGELARAN,Jl Kemuning Blok F3 Taman Pagelaran,PADASUKA,NEGERI
68,20232374,SMAN 1 CIOMAS,JL. CIBINONG,Sukaharja,NEGERI
69,20232338,SMAS IBNU AQIL,JL. RAYA LALADON NO. 256 RT. 001 RW. 07,Laladon,SWASTA
70,20268864,SMAS MA ARIF NU,JL. RAYA KRETEG NO. 55 KP. SUKAJAYA RT. 01/02,Pagelaran,SWASTA
71,69893376,SMK BHAKTI MEDIKA,JL. RAYA CIOMAS PERMAI NO 09,Pagelaran,SWASTA
72,69876824,SMK INFORMATIKA BINA GENERASI 2,JL. TAMAN PAGELARAN NO 2,Padasuka,SWASTA
73,20254135,SMKN 1 CIOMAS,JL. RAYA  LALADON DESA LALADON  KECAMATAN  CIOMAS,Laladon,NEGERI
74,20200591,SMKS IBNU AQIL BOGOR,JL.LALADON NO. 256 CIOMAS BOGOR,Laladon,SWASTA
75,20232431,SMKS INFORMATIKA BINA GENERASI BOGOR,JL.CIKERTI NO.12,Padasuka,SWASTA
76,20268466,SMKS KUSUMA BANGSA,RAYA CIAPUS BELAKANG KOMPLEK BADAK PUTIH RT. 03/04 CIOMAS BOGOR,Kota Batu,SWASTA
77,69768294,SMKS MA`ARIF NU CIOMAS,JL. RAYA KRETEG NO 55 CIOMAS,PAGELARAN,SWASTA
78,20232472,SMKS NURUL HIDAYAH 2 BOGOR,JL. KAPTEN YUSUF MUARA NO. 10 B,Kota Batu,SWASTA
79,20270945,SMKS YASPI,Jl. H. Abdullah No.1 Kp. Babakan Ciomas RT.2 RW.3,Parakan,SWASTA
80,69858469,SMP AROFAH,JL CIOMAS - CIBINONG NO. 29,PAGELARAN,SWASTA
81,20232015,SMP DHARMA NUSA,Jln. Cibinong Ciomas,SUKAHARJA,SWASTA
82,20231052,SMP IBNU AQIL,Jl. Sindangbarang No. 256,LALADON,SWASTA
83,20253556,SMP INFORMATIKA BINA GENERASI,Jl. Taman Pagelaran No. 2,Padasuka,SWASTA
84,69825140,SMP IT KAIFA,Kp.Sirnasari RT. 02/ RW. 06,Pagelaran,SWASTA
85,20231085,SMP KUSUMA BANGSA,Ciomas,Kotabatu,SWASTA
86,20200665,SMP NEGERI 1 CIOMAS,Jln Cibinong Ciomas Kab. Bogor,SUKAMAKMUR,NEGERI
87,20252282,SMP NEGERI 2 CIOMAS,Perum.alam Tirta Lestari Kp.sirnasari,Pagelaran,NEGERI
88,20200715,SMP PGRI KOTABATU,Jl. Raya Bogor Ciapus Cibogel Kotabatu Bogor,Kota Batu,SWASTA
89,69936625,SMPN 3 CIOMAS,Jalan Cempaka Ujung Komplek Paspampres,Kota Batu,NEGERI
90,20254277,SMPS MAARIF NU CIOMAS,Jl. Raya Kreteg No 55,Pagelaran,SWASTA
91,20200709,SMPS PGRI CIOMAS BOGOR,Jl.Taman Pagelaran No.62 A,Padasuka,SWASTA
