
1,69955877,Al Husainiyah,Kp. Rawa Bogo Rt 02 Rw 06,,SWASTA
2,20280111,MAS AL HIKMAH,Jl. Soal Agogo / H. Abu Bakar Rt.02/08,Tajur,SWASTA
3,20280126,MAS ASH SHOHEH,Jl. Mayor Oking Jayaatmaja No. 30 Rt. 02 Rw.01,Citeureup,SWASTA
4,60706795,MIS AL - ANWARIYAH,Jl.Raya Tajur Desa Pasir Mukti Rt.01/04,-,SWASTA
5,69725315,MIS AL FATH,Kp.Tangkil Rt. 05/02,-,SWASTA
6,60706796,MIS AL HIDAYAH,Jl. Sabilillah Kp. Pasir Angin RT. 01/08 Desa Tajur,-,SWASTA
7,60706797,MIS AL HIKMAH,Jl.H.Abu Bakar Rt.02/08 Ds.Tajur,-,SWASTA
8,60706798,MIS AL IHSAN,Kp.Rawa Bogo RT 01 RW 05 Desa Pasir Mukti,-,SWASTA
9,60706811,MIS AL IKHLAS PASIR MUKTI,Kp.Pasir Angin rt.02 rw.03,-,SWASTA
10,60706799,MIS AL KHAIRIYAH,"Jl. PTP XI Hambalang No. 76,  Kp./Ds. Tajur Rt.04/03",-,SWASTA
11,60706810,MIS AL KHOERIYAH HAMBALANG,Kp.Tapos Rt.25 Rw.08 Ds Hambalang,-,SWASTA
12,60706809,MIS AL WASILAH,Kp.Tajur Tapos RT.23 RW.07 Desa Hambalang,-,SWASTA
13,60707098,MIS AR RAYAN,Kp.Nagrak Rt.06/01,-,SWASTA
14,60707082,MIS AS SYAFIIYYAH,Parung Aleng Tegal,-,SWASTA
15,60706800,MIS DARUSSALAM,Kp.Tonggoh RT 03/03 Desa Gunungsari,-,SWASTA
16,60707084,MIS FATHUL KHOERIYAH,Kp.Sukaraja Desa Cikeas,-,SWASTA
17,60706801,MIS ISLAMIYAH,Jl. Sirkuit Sentul RT 03/06  Desa Leuwinutug Kecamatan Citeureup Kabupaten Bogor,-,SWASTA
18,60707088,MIS MANBAUL FALAH,Kp. Babakan Rt.02/03,-,SWASTA
19,69726172,MIS MIFTAHUL HUDA,Kp.Bojong Rt.02/04 desa tarikolot,-,SWASTA
20,60706802,MIS MIFTAHUSSHIBYAN,Kp.Kebon Kopi RT.01/08,-,SWASTA
21,69819500,MIS MuMinul Azhar,Kp.Rawa Bogo Rt02/05 Desa Pasir Mukti,Citeureup,SWASTA
22,60706803,MIS NURUL FALAH,Jl. Pahlawan Kp.Kambing Rt.1/5,-,SWASTA
23,69725314,MIS NURUL HIDAYAH,"Kp.Bolang Rt.02/05 Desa Tajur, Kec. Citeureup Kab. Bogor",-,SWASTA
24,60707090,MIS NURUL ISLAM,Bj.Jengkol Rt.01/05,-,SWASTA
25,60707091,MIS NUURUL QUR `AN,Kp. Parung Aleng Rt.02/07,Citeureup,SWASTA
26,60706805,MIS RAUDHATUSSALAM SUKAHATI,Kp.Sangkali Ds.Sukahati Kec.Citeureup kab.Bogor,-,SWASTA
27,60707093,MIS RAUDLATUL FALAH I,Kp.Pasirjambu Rt. 05/02,-,SWASTA
28,60707094,MIS RAUDLATUL MUBTADI IN,Batu Gede Rt.01/07,-,SWASTA
29,60706804,MIS RAUDLATUSSALAM,"Kp.Babakan Rt.01/II Ds.Tarikolot Citeureup - Bogor, Jawa Barat",Tangkil,SWASTA
30,60706806,MIS SABILUL KHOER,JL.KH.Natsir Kp.Lemper RT 03/06,-,SWASTA
31,60706808,MIS TARBIYATUL FALAH,Kp.Tajur Rt.03/II Ds.Tajur,-,SWASTA
32,60706807,MIS TARBIYATUL FALAH,Kp.Tajur Tapos RT 21 RW 07 Ds.Hambalang,-,SWASTA
33,69927424,MISAl Mursyid,Jl.Sabillah Rt.03/Rw.01 Ds.Tarikolot,-,SWASTA
34,20277503,MTSS AL HIDAYAH,Jl. Sabilillah Kp. Pasir Angin Rt.01/08,Tangkil,SWASTA
35,20277504,MTSS AL KHAIRIYAH,Jl. Ptp Xi Hambalang No. 76  Rt 04/03,Tajur,SWASTA
36,20277511,MTSS AL-MURQONIYAH,Jl. Tajur Tapos Rt. 021 Rw. 007,Hambalang,SWASTA
37,20277512,MTSS AL-WASILAH,Kp. Tajur Tapos Rt.23 Rw.07,Hambalang,SWASTA
38,20277505,MTSS ASH SHOHEH,Jl. Ash Shoheh No. 17 Rt.01/03,-,SWASTA
39,20277506,MTSS DARUL FALAH,Jl.golf Jagorawi No. 2 Karanggan Rt. 04 Rw. 01,-,SWASTA
40,20277507,MTSS DARUL MUSLIM,Jl.raya Tajur Gg. Sabur  No. 54 Rt.04 Rw.01,Tarikolot,SWASTA
41,20277508,MTSS MADANI,Kp. Kebon Kopi RT. 01/08 Desa Puspasari,-,SWASTA
42,20277509,MTSS RAUDHATUL HUDA,"Kp.sanja Rt,01 Rw. 02",-,SWASTA
43,20277510,MTSS RAUDHATUSSALAM,Jl. Pahlawan Kh Zen No.01 Rt 001/002,-,SWASTA
44,20254591,SD AL ASHR,Taman Kenari Jagorawi Blok 5 Rt. 04/11,Puspasari,SWASTA
45,69883274,SD AL-TAQWA COLLEGE INDONESIA,KP. HAMBALANG RT 05 RW 02,Hambalang,SWASTA
46,20237875,SD AZZAHRA,Jl. Karanggan,PUSPASARI,SWASTA
47,20201344,SD ISLAM ARROHMAN,Jl. Pahlawan No.10 Rt.03/04,SANJA,SWASTA
48,20201343,SD ISLAM KARYA MUKTI,Jl. Mayor Oking Jaya Atmaja,PUSPANEGARA,SWASTA
49,20201904,SD N CITEUREUP 02,Jl. Baru Puspanegara,Puspanegara,NEGERI
50,20201905,SD N CITEUREUP 03,Jl. Pos 03 Kp. Kamurang Rt. 03 / Rw. 08,Puspanegara,NEGERI
51,20201906,SD N CITEUREUP 04,Jl Baru Puspanegara,PUSPANEGARA,NEGERI
52,20201908,SD N CITEUREUP 06,Jln.Pahlawan No.07,CITEUREUP,NEGERI
53,20230509,SD N GUNUNGSARI 02,Kp. Mumunggang Rt. 04 Rw. 02,GUNUNGSARI,NEGERI
54,20201568,SD N HAMBALANG 02,Jl.Ds Hambalang Rt.09/03,HAMBALANG,NEGERI
55,20230512,SD N HAMBALANG 04,Kp. Cikalahang Rt. 14 Rw. 05,HAMBALANG,NEGERI
56,20201570,SD N HAMBALANG 05,Jl. Anyar RT 05 / 02 Ds. Leuwinutug,Leuwinutug,NEGERI
57,20201663,SD N KARANG ASEM 01,Jl Pahlawan No 72 Rt 06 Rw 02,KARANG ASEM BARAT,NEGERI
58,20201660,SD N KARANG ASEM BARAT 03,Kp. Kaum Rt. 05 Rw. 02,KARANG ASEM BARAT,NEGERI
59,20201624,SD N LANBAU 01,Kp. Lanbau Rt. 01/10,KARANG ASEM BARAT,NEGERI
60,20200380,SD N LEUWINUTUG 01,"Jl. Raya Pahlawan, Citeureup - Sentul No. 26 Kec. Citeureup. Kab. bogor",Sanja,NEGERI
61,20200381,SD N LEUWINUTUG 02,Jl. Raya Citeureupsentul,SANJA,NEGERI
62,20200382,SD N LEUWINUTUG 03,Jl. Anyar Desa Leuwinutug,Leuwinutug,NEGERI
63,20200383,SD N LEUWINUTUG 04,Kp Liobaru Rt 03 Rw 03,SANJA,NEGERI
64,20200384,SD N LEUWINUTUG 05,Kp. Setu  Rt.03  Rw.05,LEUWI NUTUG,NEGERI
65,20230552,SD N MUHARA 02,Jl. Bogasari Kp. Muhara Baru RT 01/08,Citeureup,NEGERI
66,20200104,SD N PUSPANEGARA 01,Jl. Baru Puspanegara,PUSPANEGARA,NEGERI
67,20200106,SD N PUSPANEGARA 03,Jl Baru Puspanegara,PUSPANEGARA,NEGERI
68,20200107,SD N PUSPANEGARA 04,Kp. Bojong RT. 02/07,Puspanegara,NEGERI
69,20200108,SD N PUSPANEGARA 05,Jl. Lingkar Puspanegara RT 03/09,Puspanegara,NEGERI
70,20200110,SD N PUSPANEGARA 07,Jl. Karanggan No. 33 RT. 01 RW. 03,Puspasari,NEGERI
71,20200135,SD N PUSPANEGARA 08,Jl. Baru Puspanegara,PUSPANEGARA,NEGERI
72,20200289,SD N SANGKALI,Jl. Pangeran Samiaji,Sukahati,NEGERI
73,20200290,SD N SANJA 01,Kp. liobaru Rt 02 rw 06 Desa Sanja Kec Citeureup Kab bogor,Sanja,NEGERI
74,20200253,SD N SUKAHATI 01,Jl. Pangeran Samiaji No. 2,SUKAHATI,NEGERI
75,20200267,SD N SUKAHATI 03,KP.MALINGPING RT03/RW06,Sukahati,NEGERI
76,20200928,SD N TARIKOLOT 01,Jl. Raya Tajur Tarikolot Rt. 01/01,TARIKOLOT,NEGERI
77,20200907,SD N TARIKOLOT 04,Kp. Bojong Unduk Rt. 05/04,TARIKOLOT,NEGERI
78,20200908,SD N TARIKOLOT 05,Kp. Babakan Rt. 02/05,TARIKOLOT,NEGERI
79,20200909,SD N TARIKOLOT 06,Jl. Branta Mulya Kp. Sabur,Tarikolot,NEGERI
80,20201903,SD NEGERI CITEUREUP 01,Jl. Kh. Nasir No. 105 Kp. Geber Rt. 02 Rw. 04,Citeureup,NEGERI
81,20201907,SD NEGERI CITEUREUP 05,Jl. Kh. Natsir No. 56,Citeureup,NEGERI
82,20201909,SD NEGERI CITEUREUP 07,Jl.kh.natsir No. 54,CITEUREUP,NEGERI
83,20201855,SD NEGERI GUNUNGSARI 01,Kp. Nyangkokot RT 01/06,Gunung Sari,NEGERI
84,20201547,SD NEGERI GUNUNGSARI 03,Kp. Nyangkokot,GUNUNGSARI,NEGERI
85,20201548,SD NEGERI GUNUNGSARI 04,Kp. Tonggoh Rt. 02 Rw. 02,GUNUNGSARI,NEGERI
86,20200321,SD NEGERI HAMBALANG 01,Jl. Kampung Baru Rt. 05/02,HAMBALANG,NEGERI
87,20201569,SD NEGERI HAMBALANG 03,Kp. Tajur Tapos Rt. 19/06,HAMBALANG,NEGERI
88,20230526,SD NEGERI KARANG ASEM TIMUR 01,Jl. PT Amalgam RT.03 RW.07,KARANG ASEM TIMUR,NEGERI
89,20230527,SD NEGERI KARANG ASEM TIMUR 02,Jl. PT Roda Vivatex,Karang Asem Timur,NEGERI
90,20201625,SD NEGERI LANBAU 02,Kp.lanbau,KARANGASEM BARAT,NEGERI
91,20200330,SD NEGERI MUHARA 01,"Jl Bogasari, Kp Muhara, Rt 01 / Rw 08",Citeureup,NEGERI
92,20200105,SD NEGERI PUSPANEGARA 02,Jl. Pos 3 Kamurang,PUSPANEGARA,NEGERI
93,20200109,SD NEGERI PUSPANEGARA 06,Jl. Wijaya Kusuma III,Karang Asem Barat,NEGERI
94,20200136,SD NEGERI PUSPASARI 01,Jl. Kranggan No. 34,PUSPASARI,NEGERI
95,20200752,SD NEGERI TAJUR 01,Kp. Tajur Rt. 04 Rw. 01,TAJUR,NEGERI
96,20200753,SD NEGERI TAJUR 02,Jl Raya Tajur Leuwiblik Km. 4 Desa Tajur Kecamatan Citeureup- Bogor,Tajur,NEGERI
97,20200754,SD NEGERI TAJUR 03,Jl H Abu Bakar,TAJUR,NEGERI
98,20200755,SD NEGERI TAJUR 04,Kp. Babakan Rt 02 / 05,Tarikolot,NEGERI
99,20200769,SD NEGERI TAJUR 05,Kp. Rawa Bogo RT.04/06,Pasir Mukti,NEGERI
100,20200770,SD NEGERI TAJUR 06,Jln Raya Tajur Leuwibilik Km 1,TAJUR,NEGERI
101,20200771,SD NEGERI TAJUR 07,Kp. Parung Ponteng  Rt.01  Rw.07,Tajur,NEGERI
102,20200906,SD NEGERI TARIKOLOT 03,Jl Industri Tarikolot Rt 03/07,Tarikolot,NEGERI
103,20230625,SD S AL UTSMANIYAH,Kp. Dukuh,PASIR MUKTI,SWASTA
104,20201830,SDN DUKUH,Jln. Sabilillah Desa Pasir Mukti,Pasir Mukti,NEGERI
105,20200917,SDN TARIKOLOT 02,"Kp.Tonggoh, Ds. Gunungsari, Kec. Citeureup",Gunungsari,NEGERI
106,20237874,SDS AR-RIYADL,Jl. Jembatan 2,Karang Asem Barat,SWASTA
107,20252077,SMA INTERNATIONAL ISLAMIC SCHOOL OF INDONESIA,KP. HAMBALANG RT/RW 05/02,Hambalang,SWASTA
108,20200603,SMAN 1 CITEUREUP,Jl. Alternatif Tengsaw-Tajur No.1,Tarikolot,NEGERI
109,20232310,SMAS AL KHAIRIYAH,JL. PTP XI  HAMBALANG NO 76 DS. TAJUR CITEUREUP,Tajur,SWASTA
110,20231299,SMAS INDOCEMENT,JL. RAYA PUSPA NEGARA NO. 1 KEL. PUSPA NEGARA,Citeureup,SWASTA
111,20254122,SMAS PUSPA MEKAR,KP. NYANGKOKOT RT.04 RW.05,Gunung Sari,SWASTA
112,20200675,SMAS TRIPLE J CITEUREUP,"JL. LANDBOUW , DS. KARANG ASEM BARAT NO.25",Karang Asem Barat,SWASTA
113,69957149,SMK AL MURQONIYAH,Kp. Tajur Tapos Rt 021/007,Hambalang,SWASTA
114,20279946,SMK BHAKTI KENCANA,Kampung Babakan RT.004/002,Tarikolot,SWASTA
115,20232490,SMKS 1 TRIPLE J,JL. LANDBOW NO.01 KARANG ASEM BARAT CITEUREUP,KARANG ASEM BARAT,SWASTA
116,20232491,SMKS 2 TRIPLE J CITEUREUP,"JL. LANBOUW, KARANG ASEM BARAT CITEUREUP BOGOR",Karang Asem Barat,SWASTA
117,20232424,SMKS ASH SHOHEH 1 CITEUREUP,JL. ASH SHOHEH NO. 17 CITEUREUP BOGOR,Citeureup,SWASTA
118,20232425,SMKS ASH SHOHEH 2 CITEUREUP,JL. ASH-SHOHEH NO. 17 CITEUREUP BOGOR,CITEUREUP,SWASTA
119,20280627,SMKS BINA MANDIRI SEJAHTERA,JL MAYOR OKING JAYA ATMAJA NO 27,CITEUREUP,SWASTA
120,20231394,SMKS BUDINIAH,JL.GOLF JAGORAWI NO. 2 KARANGGAN PUSPASARI CITEUREUP,Puspasari,SWASTA
121,20246432,SMKS BUDINIAH 2 CITEUREUP,JL. GOLF JAGORAWI NO. 2 KARANGGAN,Puspasari,SWASTA
122,20280618,SMKS DARUL MUSLIM,JL RAYA TAJUR RT 04/01 GANG KABUR,DESA TARIKOLOT,SWASTA
123,20270490,SMKS ISLAM MADANI AL HUSAINIYAH,JL RAYA TAJUR KP RAWA BOGO,Pasir Mukti,SWASTA
124,20269709,SMKS KESEHATAN ANNISA,JL.KARANGGAN NO 2,Puspasari,SWASTA
125,10648863,SMKS KESEHATAN ANNISA 3,JL. KARANGGAN NO. 25 CITEUREUP BOGOR,Puspasari,SWASTA
126,20269416,SMKS KESEHATAN TRIPLE J,LANDBAW,Karang Asem Barat,SWASTA
127,20269642,SMKS KSATRIA BANGSA CITEUREUP,JL. RAYA LEUWIBILIK KM.01,Tajur,SWASTA
128,20279817,SMKS PANCA KARYA SENTUL,JL. DESA SANJA RT 06 RW 06,Karang Asem Barat,SWASTA
129,20231434,SMKS PGRI CITEUREUP,Jl. Pahlawan No. 72,Karang Asem Barat,SWASTA
130,69756124,SMKS PUSPA MEKAR,"PERUM INDOGREEN BLOK G, KP NYANGKOKOT RT 04 RW 05",GUNUNG SARI,SWASTA
131,69754153,SMKS TI ANNISA 2,JL KRANGGAN NO 2 CITEUREUP,PUSPASARI,SWASTA
132,20232493,SMKS WIDYA DHARMA 1 CITEUREUP BOGOR,JL. JEMBATAN DUA NO. 22 KARANG ASEM BARAT,Karang Asem Barat,SWASTA
133,20232494,SMKS WIDYA DHARMA 2 CITEUREUP,JL. JEMBATAN DUA KARANG ASEM BARAT CITEUREUP BOGOR,KARANG ASEM BARAT,SWASTA
134,20252078,SMP AL-TAQWA COLLEGE INDONESIA,KP. HAMBALANG RT 05 RW 02,Hambalang,SWASTA
135,20276165,SMP ARSYADA,Jl. Pahlawan Gg. Masjid Desa Karang Asem Timur,Karang Asem Timur,SWASTA
136,20231057,SMP ISLAM AR RIDHO,JL. SMAN 1 Citeureup Kp. Babakan rt. 03 rw. 05 Desa Tarikolot Kec. Citeureup,Tarikolot,SWASTA
137,20231081,SMP ISLAM KARYAMUKTI,Jl. Mayor Oking Jayaatmaja No 137,Karang Asem Barat,SWASTA
138,20231074,SMP ISLAM YAFAC,Jl. Mayor Oking Jayaatmaja No 30,CITEUREUP,SWASTA
139,69968051,SMP IT AL UTSMANIYAH,Jl Sabililah Kp Dukuh RT 003/002,Pasir Mukti,SWASTA
140,20200577,SMP KUWWA KENCANA,Jln.KH.Ahmad Syafei No. 23 RT 05 RW 01 Desa Gunungsari,Gunung Sari,SWASTA
141,20200692,SMP NEGERI 1 CITEUREUP,Jl Karanggan No.33,PUSPASARI,NEGERI
142,20200643,SMP NEGERI 2 CITEUREUP,Jl. Leuwi Bilik Desa Tajur No. 11,Tajur,NEGERI
143,20244714,SMP NEGERI 3 CITEUREUP,Jl. Raya Tajur Kp. Babakan,Tarikolot,NEGERI
144,69980810,SMP PAKAR,Jl Sanja RT 006/006,Karang Asem Barat,SWASTA
145,20200710,SMP PGRI CITEUREUP,Jl. Pahlawan No.7 Citeureup Kab. Bogor,CITEUREUP,SWASTA
146,20254121,SMP PUSPA MEKAR,Kp. Nyangkokot Rt 04 Rw 05,GUNUNGSARI,SWASTA
147,20200702,SMP PUSPANEGARA,Jl. Raya Puspanegara No. 1,PUSPANEGARA,SWASTA
148,20200701,SMP PUSPAWIYATA,Jl. Lanbaw Km2 Lio Baru RT.002/003,Sanja,SWASTA
149,20200739,SMP TRIPLE J,Jln Landbau Rt. 01/10,Karang Asem Barat,SWASTA
150,20231168,SMP YAPENI,Jln Mayor Oking Jayaatmaja No 26,PUSPA NEGARA,SWASTA
151,20200720,SMP YASDIQ,"Jl Raya Citeureup Bekasi, Gg Masjid Istqomah, Housing I",Puspanegara,SWASTA
152,20231172,SMP YASKITTA,Jl.Desa Hambalang No.01,Hambalang,SWASTA
153,20268433,SMPS AKADEMIA,Jl Sabillilah Pasir Angin 03/04,Pasir mukti,SWASTA
154,60729038,SMPS DHARMA PERTIWI,JL. H. ABU BAKAR RT.04/08  DESA TAJUR,CITEUREUP,SWASTA
155,20253329,SMPS ISLAM ARROHMAN,Jl Raya Pahawan No.10 Sanja,Sanja,SWASTA
156,20270061,SMPS Islam Attaufiq,Kp Tonggoh Rt 03 Rw 01,Gunung Sari,SWASTA
