
1,30315593,MAN TANAH BUMBU,JL. H.M. NURUNG RT.03,Kota Pagatan,NEGERI
2,30315594,MAS AL-KAUTSAR,JL. SUNGAI KUSAN RT. 02 NO. 38,Satiung,SWASTA
3,60723121,MIN TANAH BUMBU,JL. SUNGAI KUSAN RT.02,Satiung,NEGERI
4,60723123,MIS AL - IKHLAS,JL. HASTA KARYA I No. 50,Pagar Ruyung,SWASTA
5,60723122,MIS DARUL MUTAMMAM,JL. H. M. AMIN NO.10 RT. 1,Rantau Panjang Hulu,SWASTA
6,30315449,MTsN 1 TANAH BUMBU,Jl. H.M. Amin Rt. V,Mudalang,NEGERI
7,30315450,MTsN 2 TANAH BUMBU,JL. SUNGAI KUSAN RT 02,Satiung,NEGERI
8,30315452,MTSS DDI MUARA PAGATAN,JL. HM. NURUNG,Muara Pagatan,SWASTA
9,30315451,MTSS NU AL-FALAH,JL. Annur NO.52 RT.05,Pasar Baru,SWASTA
10,30303682,SD MUHAMMADIYAH,Jl. Mesjid Jami No 62,Kota Pagatan,SWASTA
11,30303698,SD NEGERI 1 BATUAH,Jl. P. Antasari,Batuah,NEGERI
12,30303743,SD NEGERI 1 KOTA PAGATAN,Jl. Abdul Sukur Rahim No.129,Kota Pagatan,NEGERI
13,30303759,SD NEGERI 1 MANURUNG,"Jl. Hm. Amin Km.5,5",Manurung,NEGERI
14,30303670,SD NEGERI 1 PASAR BARU,Jl. H. M Badri RT. I,Pasar Baru,NEGERI
15,30303579,SD NEGERI 1 SALIMURAN,Jl. Tepian Sungai Kusan,Salimuran,NEGERI
16,30303551,SD NEGERI 1 SEPUNGGUR,Jl. Raya Batulicin,Sepunggur,NEGERI
17,30303697,SD NEGERI 2 BATUAH,Jl. Melati,Batuah,NEGERI
18,30303758,SD NEGERI 2 MANURUNG,JL.H.M.AMIN,Manurung,NEGERI
19,30303607,SD NEGERI 2 PASAR BARU,Jl. A. Yani No.09 Pagatan,Pasar Baru,NEGERI
20,30303592,SD NEGERI 2 SALIMURAN,Tepian Sungai Kusan,Salimuran,NEGERI
21,30303545,SD NEGERI 2 SEPUNGGUR,Jl. Raya Batulicin Km.12,SEPUNGGUR,NEGERI
22,30303696,SD NEGERI 3 BATUAH,Jl. Mustika,Batuah,NEGERI
23,30303591,SD NEGERI 3 PASAR BARU,Jl. Arif Rahman Hakim Gg.Kedondong,Pasar Baru,NEGERI
24,30303673,SD NEGERI BARUGELANG,Jl. Padat Karya,Baru Gelang,NEGERI
25,30303688,SD NEGERI BERINGIN,Jl. Padat Karya,Beringin,NEGERI
26,30303671,SD NEGERI BETUNG,"Jalan Provinsi, No. 12",Betung,NEGERI
27,30303779,SD NEGERI JUKU EJA,Jl. Arif Rahman Hakim,Juku Eja,NEGERI
28,30303780,SD NEGERI KAMPUNG BARU,JL. KUSUMA NEGARA,Kampung Baru,NEGERI
29,30303754,SD NEGERI MUARA PAGATAN TENGAH,Jl. Ladeleng No.52 Rt.1 Kec. Kusan Hilir,Muara Pagatan Tengah,NEGERI
30,30303753,SD NEGERI MUARA PAGATAN UJUNG,Jl. Ladongnga RT. 02 No.23,Muara Pagatan,NEGERI
31,30303752,SD NEGERI MUDALANG,Jl H.M.Amin Rt.IV No.171,Mudalang,NEGERI
32,30303749,SD NEGERI PAKATELU,Jl. Saring Sei Bubu,Pakatellu,NEGERI
33,30311622,SD NEGERI PENYOLONGAN,Desa Penyolongan,PENYOLONGAN,NEGERI
34,30303587,SD NEGERI PULAU SATU,JLN. TEPIAN SUNGAI KUSAN,Pulau Satu,NEGERI
35,30303586,SD NEGERI PULAU TANJUNG,Jl. Tepian Sei Kusan,Pulau Tanjung,NEGERI
36,30303584,SD NEGERI RANTAU PANJANG,Jl. Raya Batulicin-rantau Panjang,Rantau Panjang Hilir,NEGERI
37,30303593,SD NEGERI SARDANGAN,Jl. Tepian Sungai Kusan,Serdangan,NEGERI
38,30303598,SD NEGERI SARING SUNGAI BINJAI,Jl. Tepian Sungai Kusan,Saring Sei Binjai,NEGERI
39,30303599,SD NEGERI SARING SUNGAI BUBU,Saring Sei Bubu,Saring Sei Bubu,NEGERI
40,30303597,SD NEGERI SATIUNG,Jl. Tepian Sungai Kusan  RT 3  No. 83,Satiung,NEGERI
41,30303596,SD NEGERI SATIUNG SALIMURAN,Jl. Duku Rt 2,Upt. Karya Bhakti,NEGERI
42,30303562,SD NEGERI SUNGAI LEMBU,Jl.sebamban,Sei Lembu,NEGERI
43,30303652,SD NEGERI TANETE,Jl. H.M.ALI,Tanette,NEGERI
44,P9970262,SKB Tanah Bumbu,Jl. Lapangan 07 Februari,Kota Pagatan,NEGERI
45,30303656,SMAN 1 KUSAN HILIR,"JL. Kusuma Negara km 2,2",Kampung Baru,NEGERI
46,30303619,SMKN 1 KUSAN HILIR,Jl. Pembangunan RT. 2,Pulau Salak,NEGERI
47,69772941,SMKS Muhammadiyah Kusan Hilir,Jl. Anang Panangah,Pasar Baru,SWASTA
48,30303615,SMP MUHAMMADIYAH,Jl. Jati Rt. 03,Kota Pagatan,SWASTA
49,30303612,SMP NEGERI 1 KUSAN HILIR,Jl. 7 Pebruari Pagatan No. 6,Kota Pagatan,NEGERI
50,30303623,SMP NEGERI 2 KUSAN HILIR,Jl. Pangeran Antasari V/ No.78,Batuah,NEGERI
51,30303632,SMP NEGERI 3 KUSAN HILIR,Desa Saring Sei Bubu,SARING SEI BUBU,NEGERI
52,30311411,SMP NEGERI 4 SATU ATAP KUSAN HILIR,Jl. Raya Batulicin,Sepunggur,NEGERI
53,30311413,SMP NEGERI 5 KUSAN HILIR,Jl. Propinsi,Betung,NEGERI
54,30311415,SMP NEGERI 6 SATU ATAP KUSAN HILIR,Jl. Duku Rt 02,Upt. Karya Bhakti,NEGERI
55,30311418,SMP NEGERI 7 KUSAN HILIR,Desa Kampung Baru,Kampung Baru,NEGERI
56,30313380,SMP NEGERI 8 SATU ATAP KUSAN HILIR,Jl. Tepian Sungai Kusan Desa Sardangan Rt.01 Kec. Kusan Hilir,Serdangan,NEGERI
