
1,69978962,MAN INSAN CENDEKIA PASURUAN,JL. Buntalan RT.01 RW.02,Kedawung Wetan,NEGERI
2,69894874,MAS ALMASA,Kalipang Tengah,Kalipang,SWASTA
3,20584458,MAS NURUL BADRI,PP. NURUL BADRI CURAH KERIS KALIPANG GRATI PASURUAN,Kalipang,SWASTA
4,69894677,MI NU AL AMIN 139,Lingkungan Kampung Baru Rt 02 Rw 04,Grati Tunon,SWASTA
5,60716719,MIS DARUL ULUM,DSN. KRAJAN,Rebalas,SWASTA
6,69819603,MIS DarussyafaAh,Jl. Sumbersuko RT 002 RW 011 Desa Plososari,Plososari,SWASTA
7,60730099,MIS MI MIFTAHUL ULUM RANDUKERTO TIMUR,DUSUN RANDUKERTO TIMUR RT:05 RW:08,Rebalas,SWASTA
8,20548113,MIS MIFTAHUL ULUM,Dsn. Tegalan I No.17 RT/RW ; 04/06,Kalipang,SWASTA
9,60716728,MIS MIFTAHUL ULUM,JL. KRAJAN 40,Kambingan Rejo,SWASTA
10,60716721,MIS MIFTAHUL ULUM 100,TEGALAN RT/RW:02/05,Karang Lo,SWASTA
11,60716730,MIS MIFTAHUL ULUM AL-HASANUDDIN,JL. RANDUKERTO TENGAH RT/RW:01/06,Rebalas,SWASTA
12,60716724,MIS MIFTAHUL ULUM ASSIMACHI,KALIPANG TENGAH,Kalipang,SWASTA
13,60716726,MIS MIFTAHUL ULUM CURAH KERIS,CURAH KERIS,Kalipang,SWASTA
14,60716725,MIS MU BAITUR ROHMAN,JL. TEGALAN III KALIPANG TENGGARA,Kalipang,SWASTA
15,60716718,MIS NU AS SHOLIHIN 98,DSN. KRAJAN RT 01 RW 01,Rebalas,SWASTA
16,60716720,MIS NU DARUS SALAM 99,Dusun Krikilan Rt 06 Rw 02,Kalipang,SWASTA
17,60716727,MIS NURUL HUDA PENGARENGAN,PENGARENGAN,Kalipang,SWASTA
18,69977772,MTS KH DAHLAN,KALIPANG UTARA,Kalipang,SWASTA
19,20582128,MTSN 5 PASURUAN,JL. RAYA NGOPAK KEDAWUNG WETAN GRATI KAB. PASURUAN,Kedawung Wetan,NEGERI
20,60730141,MTSS AL HASANUDDIN,JL. RAYA RANDUKERTO,Rebalas,SWASTA
21,20582078,MTSS MIFTAHUL ULUM ASSIMACHI,KALIPANG TENGAH KALIPANG - GRATI,Kalipang,SWASTA
22,20582075,MTSS MIFTAHUL ULUM BAITUR ROHMAN,JL. TEGALAN III DESA KALIPANG TENGGARA KECAMATAN GRATI KAB. PASURUAN,Kalipang,SWASTA
23,20582079,MTSS MMP DARUL ULUM,JL. RANUKLINDUNGAN,Ranu Klindungan,SWASTA
24,20582076,MTSS NURUL BADRI,CURAH KERIS,Kalipang,SWASTA
25,20582077,MTSS TERPADU MIFTAHUL ULUM,JL.TEGALAN 1 NO.03 KALIPANG TIMUR,Kalipang,SWASTA
26,69895161,Nurus Shobah,JL. Perhutani Randukerto Timur - Rebalas,Rebalas,SWASTA
27,20519519,SD NEGERI CUKURGONDANG I,Jl. Kabupaten Dusun Randukisi,Cukurgondang,NEGERI
28,20519518,SD NEGERI CUKURGONDANG II,Jalan Kebun Mangga No 89,CUKURGONDANG,NEGERI
29,20519426,SD NEGERI GRATI I,Jl Raya Grati No. 84,GRATITUNON,NEGERI
30,20519425,SD NEGERI GRATI II,Parasan,GRATITUNON,NEGERI
31,20519412,SD NEGERI KALIPANG I,Krikilan,KALIPANG,NEGERI
32,20519411,SD NEGERI KALIPANG II,KALIPANG TEGALAN I,KALIPANG,NEGERI
33,20519712,SD NEGERI KAMBINGANREJO,Krajan,KAMBINGANREJO,NEGERI
34,20519720,SD NEGERI KARANGKLIWON,Baran,KARANGKLIWON,NEGERI
35,20519719,SD NEGERI KARANGLO I,Krajan,KARANGLO,NEGERI
36,20519718,SD NEGERI KARANGLO II,Tangkis,KARANGLO,NEGERI
37,20519698,SD NEGERI KEBONREJO I,KEBONJERO,Kebon Rejo,NEGERI
38,20519697,SD NEGERI KEBONREJO II,Menangas,KEBONREJO,NEGERI
39,20519693,SD NEGERI KEDAWUNGKULON I,Adirogo,KEDAWUNGKULON,NEGERI
40,20519692,SD NEGERI KEDAWUNGKULON II,Jl Purnayudha II Dusun Joyomulyo,KEDAWUNGKULON,NEGERI
41,20519691,SD NEGERI KEDAWUNGKULON III,Jln Raya PG Kedawung,KEDAWUNGKULON,NEGERI
42,20519690,SD NEGERI KEDAWUNGWETAN I,Kajarkuning,KEDAWUNGWETAN,NEGERI
43,20519689,SD NEGERI KEDAWUNGWETAN II,Kajarkuning,KEDAWUNGWETAN,NEGERI
44,20519673,SD NEGERI KEDAWUNGWETAN III,Jalan Masjid Krawan,KEDAWUNGWETAN,NEGERI
45,20519757,SD NEGERI KEDAWUNGWETAN IV,Buntalan,KEDAWUNGWETAN,NEGERI
46,20518995,SD NEGERI PLOSOSARI I,Krajan,PLOSOSARI,NEGERI
47,20519008,SD NEGERI PLOSOSARI II,Krajan,PLOSOSARI,NEGERI
48,20519009,SD NEGERI PLOSOSARI III,Tanah Celeng,PLOSOSARI,NEGERI
49,20518953,SD NEGERI RANUKLINDUNGAN I,Jl Pahlawan,RANUKLINDUNGAN,NEGERI
50,20518938,SD NEGERI RANUKLINDUNGAN II,Jl Pahlawan No.10,RANUKLINDUNGAN,NEGERI
51,20519101,SD NEGERI REBALAS I,Jalan Raya Rebalas No. 12,REBALAS,NEGERI
52,20519100,SD NEGERI REBALAS II,Salaran,REBALAS,NEGERI
53,20519099,SD NEGERI REBALAS III,Pendoso,REBALAS,NEGERI
54,20518973,SD NEGERI SUMBERAGUNG I,Kenayan,Sumber Agung,NEGERI
55,20518972,SD NEGERI SUMBERAGUNG II,Semambung,SUMBERAGUNG,NEGERI
56,20518864,SD NEGERI SUMBERDAWESARI I,Jatisari,SUMBERDAWESARI,NEGERI
57,20518862,SD NEGERI SUMBERDAWESARI III,Genuan,SUMBERDAWESARI,NEGERI
58,20518874,SD NEGERI SUMBERDAWESARI IV,Karangselem,Sumber Dawesari,NEGERI
59,20519258,SD NEGERI TREWUNG,Krajan,TREWUNG,NEGERI
60,20519423,SDN GRATI IV,Krikilan,GRATITUNON,NEGERI
61,20519281,SMAS SYARIF HIDAYATULLAH,JL. Krawan Rt.03 Rw.05,Kedawung Wetan,SWASTA
62,20519220,SMKN 1 GRATI,JL. RAYA NGOPAK NO.1 GRATI,Kedawung Wetan,NEGERI
63,20570119,SMKS DARUL ULUM REBALAS GRATI,JL. RAYA KRAJAN DESA REBALAS KEC. GRATI KAB. PASURUAN,REBALAS,SWASTA
64,20519293,SMKS KARTIKA GRATI,JL. PAHLAWAN NO. 33 RANU GRATI,RANUKLINDUNGAN,SWASTA
65,20519159,SMP DARUL ULUM 5 REBALAS,Rebalas Krajan,Rebalas,SWASTA
66,20519218,SMP NEGERI 1 GRATI,Kedawung Wetan,Kedawung Wetan,NEGERI
67,20577838,SMP NEGERI 3 GRATI SATAP,Jln Kebun Mangga,Plososari,NEGERI
68,20519166,SMP NEGERI GRATI 02,Ranuklindungan,Ranuklindungan,NEGERI
