
1,69853456,Mambaul Ulum,Dusun Sumbergirang,Jamberejo,SWASTA
2,69788063,MAS SUNAN DRAJAT,JL. RAYA SUNAN DRAJAT NO 9 GEGER,Kedungadem,SWASTA
3,60718064,MIS BAITUL MUTTAQIN,JL H. ADNAN NO 645 DS.TLOGOAGUNG,Tlogoagung,SWASTA
4,60718054,MIS GAYA BARU,Jl. Raya Sidorejo No. 40,Sidorejo,SWASTA
5,60718057,MIS ISLAMIYAH JAMBEREJO,DSN. SUMBERGIRANG DS. JAMBEREJO,Jamberejo,SWASTA
6,60718056,MIS ISLAMIYAH KEPOHKIDUL,Dsn. Ketangi Rt/Rw: 008/007,Kepoh Kidul,SWASTA
7,60718051,MIS MUHAMMADIYAH 1 KEDUNGADEM,JL. GAJAH MADA NO. 1 A,Kedungadem,SWASTA
8,60718058,MIS MUHAMMADIYAH 14 MEGALE,MEGALE RT. 02 RW. 04 KECAMATAN KEDUNGADEM,Megale,SWASTA
9,60718059,MIS MUHAMMADIYAH 17 BALONGCABE,JL.P.U.D NO 555 BRAMBANG,Balongcabe,SWASTA
10,60718062,MIS MUHAMMADIYAH 27 GEGER,JALAN RAYA NO.10 DESA GEGER,Geger,SWASTA
11,60718063,MIS MUHAMMADIYAH 5,JL.H.AMIN NO.113 NGRANDU,Ngrandu,SWASTA
12,60718055,MIS MUHAMMADIYAH 6,JL.SUMBERWANGI NO 6,Sidomulyo,SWASTA
13,60718060,MIS MUHAMMADIYAH 9,JL. ABDURROHMAN NO.56 Dsn. Donggi RT 17 RW 03,Ngrandu,SWASTA
14,60718052,MIS NAHDLATUL ULUM,JL. KAUMAN NO. 04 TUMBRASANOM KEDUNGADEM,Tumbrasanom,SWASTA
15,60718053,MIS NURUL ISLAMIYAH,JL. KH. ISMAIL NO.307 DESA MLIDEG,Mlideg,SWASTA
16,60718061,MIS NURUL ULUM,Jl. Masjid NO. 07 Beton Desa Megale,Megale,SWASTA
17,69881912,MIS Sunan Drajat,Jl. Sunan Drajat No.9 Geger,Babad,SWASTA
18,60718065,MIS WALI SONGO,JL Raya PUK NO 351 Tlogoagung,Tlogoagung,SWASTA
19,20582617,MTSS BAITUL MUTTAQIN,JLN. H ADNAN NO.645 TLOGOAGUNG,Tlogoagung,SWASTA
20,20582618,MTSS BAITUL MUTTAQIN,JLN.KAUMAN NO. 04 TUMBRASANOM KEDUNGADEM,Tumbrasanom,SWASTA
21,20582615,MTSS MUHAMMADIYAH 2,JL. GAJAH MADA NO. 1 A KEDUNGADEM,Kedungadem,SWASTA
22,20582616,MTSS MUHAMMADIYAH 6 NGRANDU,JL. WAQAF NO.311 DS. NGRANDU,Ngrandu,SWASTA
23,69983310,MTSS PLUS NABAWI,JL. GAJAH MADA NO. 846,Kec. Kedungadem,SWASTA
24,20582619,MTSS SUNAN DRAJAT,JL.SUNAN DRAJAT NO.9 GEGER,Geger,SWASTA
25,20574721,MTSS-SA ROUDLOTUT THOLIBIN,JL. DESA BALONGCABE,Balongcabe,SWASTA
26,69894884,Roudlotut Tholibin,Jl. Krajan No. 351 Balongcabe,Balongcabe,SWASTA
27,20553254,SD ISLAM NABAWI KEDUNGADEM,Jl. Raya Ngaglik No. 28,Kedungadem,SWASTA
28,20540409,SD K MARANATHA KEDUNGADEM,Jl. Gajah Mada Gg. Plumpung No.793,Kedungadem,SWASTA
29,20540410,SD MUHAMMADIYAH I KEDUNGADEM,Jl. Puk No. 598,TLOGOAGUNG,SWASTA
30,20540414,SD NEGERI BABAD II KEDUNGADEM,Dukuh Banaran,BABAD,NEGERI
31,20540415,SD NEGERI BABAD III KEDUNGADEM,Ds. Babad,BABAD,NEGERI
32,20540416,SD NEGERI BABAD IV KEDUNGADEM,Desa Babad,BABAD,NEGERI
33,20540426,SD NEGERI BALONGCABE KEDUNGADEM,Balongcabe,BALONGCABE,NEGERI
34,20540528,SD NEGERI DAYUKIDUL I KEDUNGADEM,Dayukidul,DAYUKIDUL,NEGERI
35,20540529,SD NEGERI DAYUKIDUL II KEDUNGADEM,Dayukidul,DAYUKIDUL,NEGERI
36,20540544,SD NEGERI DROKILO I KEDUNGADEM,Jl. Mintorogo,Drokilo,NEGERI
37,20540545,SD NEGERI DROKILO II KEDUNGADEM,Drokilo,DROKILO,NEGERI
38,20540548,SD NEGERI DUWEL KEDUNGADEM,Ds. Duwel,DUWEL,NEGERI
39,20540563,SD NEGERI GEGER KEDUNGADEM,Geger,GEGER,NEGERI
40,20540584,SD NEGERI JAMBEREJO I KEDUNGADEM,Jl. Raya Jamberejo,JAMBEREJO,NEGERI
41,20540585,SD NEGERI JAMBEREJO II KEDUNGADEM,Jamberejo,JAMBEREJO,NEGERI
42,20540586,SD NEGERI JAMBEREJO III KEDUNGADEM,Jamberejo,JAMBEREJO,NEGERI
43,20540669,SD NEGERI KEDUNGADEM 1 KEDUNGADEM,Jl. Gajahmada No. 146 Desa Kedungadem,Kedungadem,NEGERI
44,20540671,SD NEGERI KEDUNGADEM III KEDUNGADEM,Jl. Ronggolawe No. 595 Desa Kedungadem,KEDUNGADEM,NEGERI
45,20540682,SD NEGERI KEDUNGREJO I KEDUNGADEM,Desa Kedungrejo,KEDUNGREJO,NEGERI
46,20540683,SD NEGERI KEDUNGREJO II KEDUNGADEM,Kedungrejo,KEDUNGREJO,NEGERI
47,20540692,SD NEGERI KENDUNG I KEDUNGADEM,Kendung,KENDUNG,NEGERI
48,20540693,SD NEGERI KENDUNG II KEDUNGADEM,Dukuh Sambong,KENDUNG,NEGERI
49,20540694,SD NEGERI KENDUNG III KEDUNGADEM,Dsn Klompok,KENDUNG,NEGERI
50,20540699,SD NEGERI KEPOHKIDUL I KEDUNGADEM,Kepohkidul,KEPOH KIDUL,NEGERI
51,20540700,SD NEGERI KEPOHKIDUL II KEDUNGADEM,Kepohkidul,KEPOHKIDUL,NEGERI
52,20540703,SD NEGERI KESONGO I KEDUNGADEM,Ds. Kesongo,KESONGO,NEGERI
53,20540704,SD NEGERI KESONGO II KEDUNGADEM,Kesongo,KESONGO,NEGERI
54,20540762,SD NEGERI MEGALE I KEDUNGADEM,Desa Megale,MEGALE,NEGERI
55,20540763,SD NEGERI MEGALE II KEDUNGADEM,Dsn. Jintel,MEGALE,NEGERI
56,20540764,SD NEGERI MEGALE III KEDUNGADEM,Dusun Sepat,MEGALE,NEGERI
57,20540772,SD NEGERI MLIDEG KEDUNGADEM,Ds. Mlideg,MLIDEG,NEGERI
58,20540782,SD NEGERI MOJOREJO KEDUNGADEM,Desa Mojorejo,MOJOREJO,NEGERI
59,20540853,SD NEGERI NGRANDU I KEDUNGADEM,Jl. Bomo No. 01,NGRANDU,NEGERI
60,20540854,SD NEGERI NGRANDU II KEDUNGADEM,Ds. Ngrandu,NGRANDU,NEGERI
61,20540897,SD NEGERI PANJANG I KEDUNGADEM,Jalan Mayangkara No. 132,Panjang,NEGERI
62,20540898,SD NEGERI PANJANG II KEDUNGADEM,Dusun Malangbong,Panjang,NEGERI
63,20540899,SD NEGERI PANJANG III KEDUNGADEM,Dsn. Tlawah Jl. Sembadan No. 488,PANJANG,NEGERI
64,20540911,SD NEGERI PEJOK I KEDUNGADEM,Ds. Pejok,PEJOK,NEGERI
65,20540913,SD NEGERI PEJOK II KEDUNGADEM,Pejok,PEJOK,NEGERI
66,20541019,SD NEGERI SIDOMULYO I KEDUNGADEM,Jl. Sumberwangi,Sidomulyo,NEGERI
67,20541020,SD NEGERI SIDOMULYO II KEDUNGADEM,Sanggar,SIDOMULYO,NEGERI
68,20541022,SD NEGERI SIDOREJO I KEDUNGADEM,Jl. Raya Sidorejo Kedungadem No. 232,SIDOREJO,NEGERI
69,20541024,SD NEGERI SIDOREJO II KEDUNGADEM,Ds. Sidorejo,SIDOREJO,NEGERI
70,20541163,SD NEGERI TLOGOAGUNG I KEDUNGADEM,Ds. Tlogoagung,TLOGOAGUNG,NEGERI
71,20541165,SD NEGERI TLOGOAGUNG II KEDUNGADEM,Jl. Puk No. 58 Rt. 01 Rw. 01 Desa Tlogoagung,TLOGOAGUNG,NEGERI
72,20541169,SD NEGERI TONDOMULO I KEDUNGADEM,Tondomulo,Tondomulo,NEGERI
73,20541170,SD NEGERI TONDOMULO II,Desa Tondomulo,TONDOMULO,NEGERI
74,20541171,SD NEGERI TONDOMULO III KEDUNGADEM,Bunten RT 02 RW 15,TONDOMULO,NEGERI
75,20541172,SD NEGERI TONDOMULO IV KEDUNGADEM,Dsn Sumengko,TONDOMULO,NEGERI
76,20541185,SD NEGERI TUMBRASANOM KEDUNGADEM,Tumbrasanom Rt. 02 Rw. 03,TUMBRASANOM,NEGERI
77,20541241,SMAN 1 KEDUNGADEM,JL. RINGINANOM NO. 1 KEDUNGADEM,Tumbrasanom,NEGERI
78,20541225,SMAS MUHAMMADIYAH 3 KEDUNGADEM,JL. GAJAH MADA NO. 1,Kedungadem,SWASTA
79,20541248,SMAS PGRI KEDUNGADEM,JL. RAYA DROKILO,Drokilo,SWASTA
80,69978558,SMK MAMBAUL ULUM,Ds. Jamberejo,Jamberejo,SWASTA
81,69862666,SMK MUHAMMADIYAH 6,JL. PUK NO 598 TLOGOAGUNG,Tlogoagung,SWASTA
82,20541255,SMKS DIRGAHAYU KEDUNGADEM,JL. RAYA 592/593 KEDUNGADEM,Kedungadem,SWASTA
83,69755546,SMKS GAMA,JL. RAYA DROKILO,Drokilo,SWASTA
84,20504403,SMP BAITUL MUTTAQIN SIDOREJO KEDUNGADEM,Jl. Raya Sidorejo Kedungadem,Sidorejo,SWASTA
85,20504404,SMP DIRGAHAYU KEDUNGADEM,Jl. Raya No. 593- 595 Kedungadem,Kedungadem,SWASTA
86,20504384,SMP MUHAMMADIYAH 5 KEDUNGADEM,Jl. Puk No. 598 Tlogoagung - Kedungadem,TLOGOAGUNG,SWASTA
87,20541359,SMP NEGERI 1 KEDUNGADEM,Jalan Raya No. 216 Kedungadem,Duwel,NEGERI
88,20541370,SMP NEGERI 2 KEDUNGADEM,Jl. Desa Ngrandu,NGRANDU,NEGERI
89,20541376,SMP NEGERI 3 KEDUNGADEM,Jl. Ds. Kendung,Kendung,NEGERI
90,20547261,SMP NEGERI SATU ATAP KESONGO KEDUNGADEM,Dk. Kedungpandan,KESONGO,NEGERI
91,20504407,SMP PGRI TONDOMULO KEDUNGADEM,Desa Tondomulo,TONDOMULO,SWASTA
92,20541387,SMP PGRI TUMBRASANOM KEDUNGADEM,Jl. Adipatianom No 04,TUMBRASANOM,SWASTA
93,20541388,SMP TARUNA KEDUNGADEM,Kepohkidul,KEPOHKIDUL,SWASTA
