
1,69883276,MAS Al-Amin,Jl. Raya Sumberpasir Timur 173-175 Pakis,Sumberpasir,SWASTA
2,69894849,MAS Daarul Ukhuwwah,Dusun Bamban Gg. 1,Asrikaton,SWASTA
3,20584229,MAS NU PAKIS,JL. H. ALWI NO. 284 PULESARI,Tirtomoyo,SWASTA
4,69894658,MI TARBIYYATUL ARIFIN,Jl. Anggodo-Lowoksuruh RT. 03  RW. 10,Mangliawan,SWASTA
5,60715143,MIS AL FATAH,"NGAMPRONG,RT.02 RW.05 BANJAREJO",Banjarrejo,SWASTA
6,60715152,MIS AL HASIB,JL. KH. HASIB 03/06 TRAJENG PAKISJAJAR,Pakisjajar,SWASTA
7,60715150,MIS AL HIDAYAT,JL RAYA BUNUT WETAN NO 986,Bunutwetan,SWASTA
8,60715151,MIS AL KHOIRIYAH,JL. RAYA TIRTOMOYO 196,Tirtomoyo,SWASTA
9,60715142,MIS AL MAARIF,JL. MASJID 18 BORO JAMBAGAN,Saptorenggo,SWASTA
10,60715149,MIS ANBAUL ULUM,JL KYAI GHOZALI RT.06 RW.06 TEGALPASANGAN- PAKISKEMBAR,Pakiskembar,SWASTA
11,60715138,MIS DARUL FALAH,BORO BUNUTRT03/08-BUNUT WETAN,Bunutwetan,SWASTA
12,60715141,MIS HASYIM ASYARI,JL. MASJID NO.33 PAKISKEMBAR-PAKIS-MALANG,Pakiskembar,SWASTA
13,60715136,MIS HAYATUL ISLAMIYAH,JL. RAYA SAPTORENGGO NO 69 RT 01 RW 06,Saptorenggo,SWASTA
14,60715137,MIS ISLAMIYAH,JL.KH.GHOZALI NO 01,Sumberkradenan,SWASTA
15,60715144,MIS MAMBAUL ULUM PAKIS,JL. H. ALWI NO. 284 TIRTOMOYO PAKIS,Tirtomoyo,SWASTA
16,60715147,MIS MINU SUMBERPASIR,JL. PA. HJ. KHODIJAH 07 PAKIS,Sumberpasir,SWASTA
17,60715140,MIS NAHDLATUL ULAMA,JL. MAWAR I NO.122 ASRIKATON PAKIS KABUPATEN MALANG,Asrikaton,SWASTA
18,60715139,MIS NU BUNUTWETAN,JL. SEMERU VII NO. 37  BUNUTWETAN-PAKIS,Bunutwetan,SWASTA
19,60715153,MIS NURUL HUDA 01,JL. KARANG TENGAH 373 PAKISJAJAR,Pakisjajar,SWASTA
20,60715145,MIS NURUL HUDA 02,"JL.RAYA TERONGDOWO 260, TIRTOMOYO PAKIS MALANG",Tirtomoyo,SWASTA
21,60715146,MIS SUNAN AMPEL,JL. SUNAN AMPEL 08/01 Ampeldento Pakis,Ampeldento,SWASTA
22,60715148,MIS WAHID HASYIM,JL. RAYA NO. 01 SUKOANYAR,Sukoanyar,SWASTA
23,20581296,MTSS AL- FAQIH,JLN. UTARA MAKAM 45,-,SWASTA
24,20581299,MTSS AL-ADNAN,JL.BALAI DESA,Pucang Songo,SWASTA
25,20581300,MTSS AL-AMIN,JL.RAYA SUMBERPASIR TIMUR NO. 173-175 KEC. PAKIS KAB. MALANG KODE POS 65154,-,SWASTA
26,20581295,MTSS DZUNNUROIN,JL. TERONGDOWO NO.264 TIRTOMOYO PAKIS MALANG,Tirtomoyo,SWASTA
27,20581297,MTSS HASYIM ASYARI PAKIS,JL. ABDUL MANAN NO 74 PAKISKEMBAR KECAMATAN PAKIS KABUPATEN MALANG,-,SWASTA
28,20581298,MTSS ISLAMIYAH PAKIS,JL. KH. GHOZALI NO 23,Sumberkradenan,SWASTA
29,20581293,MTSS MAMBAUL ULUM PAKIS,JL. H. ALWI NO. 284 TIRTOMOYO KECAMATAN PAKIS KABUPATEN MALANG,Tirtomoyo,SWASTA
30,20581294,MTSS NAHDLATUL ULAMA PAKIS,BUNUT WETAN NO. 986 PAKIS,Bunutwetan,SWASTA
31,20518733,SD ISLAM AL FAQIH,JL. SUKOANYAR NO. 27 SUKOANYAR PAKIS MALANG,Sukoanyar,SWASTA
32,20518735,SD NEGERI 1 AMPELDENTO,JL. RAYA AMPELDENTO NO.29,Ampeldento,NEGERI
33,20537318,SD NEGERI 1 ASRIKATON,JL. RAYA ASRIKATON NO.46 RT. 6 RW. 3 DUSUN UREK-UREK,Asrikaton,NEGERI
34,20565335,SD NEGERI 1 BANJAREJO,JL. BRAWIJAYA NO. 1,Banjarrejo,NEGERI
35,20518597,SD NEGERI 1 KEDUNGREJO,JL. RAYA KEDUNGREJO NO.68,Kedungrejo,NEGERI
36,20517163,SD NEGERI 1 MANGLIAWAN,JL. RAYA WENDIT BARAT 30,Mangliawan,NEGERI
37,20537332,SD NEGERI 1 PAKISJAJAR,JL. RAYA PAKIS NO. 68 RT. 1 RW. 2,Pakisjajar,NEGERI
38,20517131,SD NEGERI 1 PAKISKEMBAR,JL. RAYA PAKISKEMBAR NO. 2 RT. 1 RW. 3,Pakiskembar,NEGERI
39,20517254,SD NEGERI 1 SAPTORENGGO,JL. RAYA SAPTORENGGO NO. 2,Saptorenggo,NEGERI
40,20516840,SD NEGERI 1 SUKOANYAR,JL. PLALAR NO.14,Sukoanyar,NEGERI
41,20517078,SD NEGERI 1 SUMBERPASIR,JL. AL-MUNAWAR 03,Sumberpasir,NEGERI
42,20517676,SD NEGERI 1 TIRTOMOYO,JL. RAYA DIPOMANGGOLO NO.11,Tirtomoyo,NEGERI
43,20518611,SD NEGERI 2 AMPELDENTO,JL. SUNAN MURIA NO 238 RT. 6 RW. 3,Ampeldento,NEGERI
44,20518642,SD NEGERI 2 ASRIKATON,JL. RAYA BAMBAN NO. 260,Asrikaton,NEGERI
45,20565336,SD NEGERI 2 BANJAREJO,JL. GAJAHMADA NO. 1 RT. 8 RW. 2,Banjarrejo,NEGERI
46,20518598,SD NEGERI 2 KEDUNGREJO,JL. SAYUR NO.25 RT. 1 RW. 4,Kedungrejo,NEGERI
47,20517164,SD NEGERI 2 MANGLIAWAN,JL. RAYA MANGLIAWAN 34 RT. 4 RW. 4,Mangliawan,NEGERI
48,20537336,SD NEGERI 2 PAKISJAJAR,JL. LEDOKDOWO NO. 156 RT. 4 RW. 4,Pakisjajar,NEGERI
49,20517132,SD NEGERI 2 PAKISKEMBAR,JL. RAYA JAMBON DUSUN JAMBON RT. 1 RW. 2,Pakiskembar,NEGERI
50,20517268,SD NEGERI 2 SAPTORENGGO,JL. SAPTORAYA GANG H. TOYIB NO. 175,Saptorenggo,NEGERI
51,20571221,SD NEGERI 2 SUKOANYAR,JL. PLALAR NO.03,Sukoanyar,NEGERI
52,20517079,SD NEGERI 2 SUMBERPASIR,JL. NGRANGIN RT. 18 RW. 5 DUSUN NGRANGIN,Sumberpasir,NEGERI
53,20517662,SD NEGERI 2 TIRTOMOYO,JL. ABDILLAH NO. 291 RT. 5 RW. 2,Tirtomoyo,NEGERI
54,20518641,SD NEGERI 3 ASRIKATON,BORO SEKARAN RT 05 RW 07,Asrikaton,NEGERI
55,20576079,SD NEGERI 3 BANJAREJO,RT. 6 RW. 4 DUSUN NGAMPRONG,Banjarrejo,NEGERI
56,20517165,SD NEGERI 3 MANGLIAWAN,JL. RAYA KAPI WORO NO. 25,Mangliawan,NEGERI
57,20517255,SD NEGERI 3 SAPTORENGGO,JL. RAYA LANUD ABD. SALEH,Saptorenggo,NEGERI
58,20517241,SD NEGERI 4 SAPTORENGGO,JL. RAYA LANUD ABD. SALEH,Saptorenggo,NEGERI
59,20517242,SD NEGERI 5 SAPTORENGGO,KOMP. AMARTA ABD SALEH MALANG,Saptorenggo,NEGERI
60,20517243,SD NEGERI 6 SAPTORENGGO,JL. BUGIS I 89  RT. 5 RW. 5,Saptorenggo,NEGERI
61,20518845,SD NEGERI BUNUTWETAN,JL. GARUDA 6 NO.705,Bunutwetan,NEGERI
62,20517327,SD NEGERI PUCANGSONGO,JL. SIMPANG TIGA NO. 1 RT. 8 RW. 3,Pucang Songo,NEGERI
63,20537339,SD NEGERI SEKARPURO,JL. RAYA SEKARPURO NO. 8 RT. 21 RW. 6,Sekarpuro,NEGERI
64,20517051,SD NEGERI SUMBERKRADENAN,JL. RAYA KRAJAN NO.1,Sumberkradenan,NEGERI
65,69952065,SD UNGGULAN PERMATAJINGGA,"BOULEVARD AVENUE III JL. RAYA KAPI SUBALI 18 SEKARPURO, PAKIS MALANG",Sekarpuro,SWASTA
66,69966093,SMA ISLAM TERPADU ASY SYADZILI,Jl. Pa. Hj. Khodijah No. 99b,Sumberpasir,SWASTA
67,20517817,SMAS NAHDLATUL ULAMA PAKIS,JL. H. MUSTOFA 108 PAKIS,PAKISKEMBAR,SWASTA
68,69964474,SMK IT ASY - SYADZILI,JL. RAYA SUMBERPASIR NO.99A,Sumberpasir,SWASTA
69,69968132,SMK PRODUKTIF AL ISLAM,Jl. Jaya Srani Raya No. 17F/12,Sekarpuro,SWASTA
70,20517741,SMKS MAARIF NU 4 PAKIS,JL. MUSTOFA 108 PAKIS,Pakiskembar,SWASTA
71,20517764,SMKS MUHAMMADIYAH 8 PAKIS,JL. RAYA SUMBERPASIR 188 PAKIS,Sumberpasir,SWASTA
72,20549694,SMKS PGRI 4 PAKIS,JL. RAYA SEKARPURO NO. 8,Sekarpuro,SWASTA
73,20549519,SMKS PGRI PAKIS GRAFIKA,JL. RAYA WENDIT BARAT PERUM MANGLIAWAN PERMAI,Mangliawan,SWASTA
74,20571078,SMP AL HASIB PAKIS,JL.KH. HASIB TRAJENG PAKIS,Pakisjajar,SWASTA
75,20573043,SMP DAARUL UKHUWWAH,Dusun Bamban Desa Asrikaton Pakis,Asrikaton,SWASTA
76,20517458,SMP ISLAM PAKIS,Jl. Raya Tirtomoyo 196,Tirtomoyo,SWASTA
77,69970977,SMP ISLAM TERPADU DAAR EL QURAN,DUSUN KRAJAN RT. 01 RW. 02,Bunutwetan,SWASTA
78,20577695,SMP IT ASY-SYADZILI,Jl. PA HJ. KHODIJAH 99 B,Sumberpasir,SWASTA
79,20517465,SMP NEGERI 1 PAKIS,JL. RAYA SUMBER PASIR NO. 18,Sumberpasir,NEGERI
80,20517505,SMP NEGERI 2 PAKIS,JL. GAJAHMADA BANJAREJO,Banjarrejo,NEGERI
81,20566372,SMP NU NURUL HUDA PAKIS,JL. MASJID GG.03 BAMBAN,Asrikaton,SWASTA
82,20517383,SMP NU PAKIS,JL. H. MUSTOFA 108 PAKIS,Pakiskembar,SWASTA
83,20517554,SMP PGRI PAKIS,JL. MAWAR II RT 13 RW 02,Asrikaton,SWASTA
84,69992895,SMP TAHFIDZ AL-MANSHURIN,Jl. Kapi Menda VII 11/F/45 RT. 05 RW. 17,Mangliawan,SWASTA
85,20562763,SMPI AL FAQIH,JL. UTARA MAKAM NO 45,SUKOANYAR,SWASTA
