
1,20584138,MAS AL ABROR,JL. RAYA SUKOSEWU NO. 147,Sukosewu,SWASTA
2,20584144,MAS AL-MUTAMAKKIN,JL. SUTOJIWO NO. 708 DUKUH TLAPAK,Sitiaji,SWASTA
3,20580134,MAS MAMBA`UL ULUM,JLN. PESANTREN NO. 110 KLEPEK SUKOSEWU,Klepek,SWASTA
4,69788056,MAS MIFTAHUL ULUM,JL. RAYA DESA SITIAJI 03/01,Sukosewu,SWASTA
5,60718129,MIS AL FATAH,DK. KALISAT,Sumberejo Kidul,SWASTA
6,60718132,MIS AL-MUSTHOFA,JL. P. SUDIRMAN RT 08 RW 02 KLEPEK SUKOSEWU BOJONEGORO,Klepek,SWASTA
7,60718143,MIS AT-THORIQOH,JL.SUTOJIWO NO.687 DS.SITIAJI KEC.SUKOSEWU KAB.BOJONEGORO,Sitiaji,SWASTA
8,60718140,MIS DARUL ULUM,JLN MASJID AL-QOHAR NO 330,Purwoasri,SWASTA
9,60718128,MIS FALAHIYAH,JLN.MADRASAH,Sidodadi,SWASTA
10,60718141,MIS FATHUL ULUM,DS. SUMBERJOKIDUL,Sumberejo Kidul,SWASTA
11,60718134,MIS FATHUL ULUM KALICILIK,DS KALICILIK TR 03 RW 01 KECAMATAN SUKOSEWU KABUPATEN BOJONEGORO,Kalicilik,SWASTA
12,60718131,MIS FATHUL ULUM SUKOSEWU,JL. RAYA SUKOSEWU NO. 170,Sukosewu,SWASTA
13,60718139,MIS HIDAYATUL MUBTADIIN,DK. KLANGKRANG DS. TEGALKODO,Tegalkodo,SWASTA
14,60718130,MIS MATLAUL ISLAM,JL. MASJID AL-BAHRI NO. 07 DK. JAJAR DS. SUKOSEWU,Sukosewu,SWASTA
15,60718138,MIS MIFTAHUL ULUM,RT 03 RW 01 DESA SITIAJI SUKOSEWU BOJONEGORO,Sitiaji,SWASTA
16,60718133,MIS MUHAMMADIYAH 10,DESA KLEPEK  KECAMATAN SUKOSEWU  KABUPATEN BOJONEGORO,Klepek,SWASTA
17,60718135,MIS MUHAMMADIYAH 13,Jl. Apokat No. 94 RT. 01 RW. 02 Dusun Mojoroto,Duyungan,SWASTA
18,60718136,MIS MUHAMMADIYAH 16 JUMPUT,JLN. GAJAH MADA NO. 40 JUMPUT,Jumput,SWASTA
19,60718137,MIS SALAFIYAH,JL HAYAM WURUK 35,Jumput,SWASTA
20,60718142,MIS WALISONGO,JL. SUMURPANDAN,Sumberejo Kidul,SWASTA
21,20582645,MTSS AL-MUTAMAKKIN,JL. SUTOJIWO NO. 708 DUKUH TLAPAK,Sitiaji,SWASTA
22,69882359,MTSS Ar-Raudloh,Jl. Raya Desa Sidodadi,Sidodadi,SWASTA
23,20582644,MTSS DARUL ULUM,JL. MASJID AL-QOHAR 330 DS.PURWOASRI,Purwoasri,SWASTA
24,20582643,MTSS MIFTAHUL ULUM SITIAJI,JL. RAYA DS. SITIAJI KEC. SUKOSEWU KAB. BOJONEGORO,Sitiaji,SWASTA
25,20582642,MTSS SALAFIYAH SYAFI`IYAH,JL. RAYA SUKOSEWU 170,Sukosewu,SWASTA
26,20582646,MTSS TERPADU MANBA`UL ULUM,JL PESANTREN NO 110 RT.09/RW.02,Klepek,SWASTA
27,20540549,SD NEGERI DUYUNGAN I SUKOSEWU,Duyungan,DUYUNGAN,NEGERI
28,20540550,SD NEGERI DUYUNGAN II SUKOSEWU,Duyungan,DUYUNGAN,NEGERI
29,20540610,SD NEGERI JUMPUT SUKOSEWU,Jalan Gajah Mada No.150,Jumput,NEGERI
30,20540621,SD NEGERI KALICILIK SUKOSEWU,Kalicilik,KALICILIK,NEGERI
31,20540708,SD NEGERI KLEPEK NO 73 SUKOSEWU,Klepek,Klepek,NEGERI
32,20540874,SD NEGERI PACING I SUKOSEWU,Pacing,PACING,NEGERI
33,20540875,SD NEGERI PACING II SUKOSEWU,Desa Pacing,PACING,NEGERI
34,20540955,SD NEGERI PURWOASRI I SUKOSEWU,Desa Purwoasri,PURWOASRI,NEGERI
35,20540956,SD NEGERI PURWOASRI II SUKOSEWU,Jl Raya Balen - Sugihwaras,PURWOASRI,NEGERI
36,20540988,SD NEGERI SEMAWOT SUKOSEWU,Desa Semawot,SEMAWOT,NEGERI
37,20540991,SD NEGERI SEMENKIDUL SUKOSEWU,Desa Semenkidul,SEMENKIDUL,NEGERI
38,20541011,SD NEGERI SIDODADI I SUKOSEWU,Sidodadi,Sidodadi,NEGERI
39,20541013,SD NEGERI SIDODADI II SUKOSEWU,Jl. Raya Sidodadi - Sukosewu,SIDODADI,NEGERI
40,20541021,SD NEGERI SIDOREJO SUKOSEWU,Desa Sidorejo,SIDOREJO,NEGERI
41,20541063,SD NEGERI SUKOSEWU,Jl. Raya Sukosewu No. 124 Desa Sukosewu,SUKOSEWU,NEGERI
42,20541092,SD NEGERI SUMBERJOKIDUL SUKOSEWU,Jl. SUMUR PANDAN,Sumberejo Kidul,NEGERI
43,20541146,SD NEGERI TEGALKODO I SUKOSEWU,Tegalkodo,TEGALKODO,NEGERI
44,20541030,SDN SITIAJI KEC. SUKOSEWU,Sitiaji,Sitiaji,NEGERI
45,20541218,SMAS ISLAM KLEPEK,JL. RAYA KLEPEK,Klepek,SWASTA
46,69889104,SMK AL KYAI SUKOSEWU,Dk. Tlapak Desa Sitiaji,Sitiaji,SWASTA
47,20504401,SMP AL MUTAMAKKIN PURWOASRI SUKOSEWU,Jl.Raya Balen Sugihwaras,Purwoasri,SWASTA
48,20541340,SMP ISLAM AL ARIF SUKOSEWU,Desa Sumberjokidul Kec. Sukosewu,Sumberejo Kidul,SWASTA
49,20504394,SMP ISLAM KLEPEK SUKOSEWU,Jl. Raya Ds. Klepek,Klepek,SWASTA
50,20541365,SMP NEGERI 1 SUKOSEWU,Jl. Raya Sukosewu,SUKOSEWU,NEGERI
