
1,60304760,SD NEGERI DADAT,Kp. Dadat,DADAT,NEGERI
2,60304780,SD NEGERI KEREMA,Kampung Kerema,KEREMA,NEGERI
3,60304794,SD NEGERI PERSIAPAN KAMAI,Kampung Kamai,KAMAI,NEGERI
4,60304801,SD NEGERI PERSIAPAN OPAHE USIA,Kampung Opahe,tidak diisi,NEGERI
5,60304808,SD NEGERI PERSIAPAN WATIARO,Kampung Watiaro,WATIARO,NEGERI
6,60304815,SD YAYASAN KODECO GESA,Kampung Kodeco Gesa,KODECO GESA,SWASTA
7,60304821,SD YPK SION BAITANISA,Kampung Baitanisa,tidak diisi,SWASTA
8,69822796,SMAN 1 BENUKI,GESA BARU,Kamai,NEGERI
9,60304831,SMP NEGERI I BENUKI,Kampung Benuki,Benuki,NEGERI
