
1,60725003,MAS JAKARTA PUSAT,Jl. Kalibaru Timur V No 104,Bungur,SWASTA
2,60706390,MIS AL-FALAH,Jl. Kramat Kwitang IIA No.46,Kwitang,SWASTA
3,20100400,MIS JAKARTA PUSAT,Jl. Kali Baru Timur V / 104,Bungur,SWASTA
4,20178150,MTSS JAKARTA PUSAT,Jl. Kali Baru Timur V/ 104,Bungur,SWASTA
5,20100370,SDN Bungur 01,Jl. Angsana No. 4,Bungur,NEGERI
6,20100372,SDN Bungur 03 Pg.,Jl. Angsana No. 4,Bungur,NEGERI
7,20104629,SDN Kenari 01,Jl. Kramat IV No. 25,Kenari,NEGERI
8,20100539,SDN Kenari 07,Jl. Salemba Raya No. 18,Kenari,NEGERI
9,20104631,SDN Kenari 08,Jl. Salemba Raya No. 18,Kenari,NEGERI
10,20100545,SDN Kramat 01,Jl. Kalibaru No. 34,Kramat,NEGERI
11,20104632,SDN Kramat 03 Pg.,Jl. Kalibaru No. 34,Kramat,NEGERI
12,20100466,SDN Kramat 05 Pagi,Jl. Kembang Sepatu No. 61,Kramat,NEGERI
13,20100467,SDN Kramat 06 Pg.,Jl. Kramat Sentiong No. 48,Kramat,NEGERI
14,20100468,SDN Kramat 07 Pt.,JL. KRAMAT SENTIONG NO. 48,Kramat,NEGERI
15,20100469,SDN KRAMAT 08 PAGI,Jl. Kramat Sentiong No. 3,Kramat,NEGERI
16,20104635,SDN Kramat 09 Pt.,Jl. Kramat Sentiong No. 3,Kramat,NEGERI
17,20104636,SDN Kwitang 01 Pagi,Jl. Kramat III Gg. Listrik I No. 2,Kwitang,NEGERI
18,20104637,SDN Kwitang 02 Pt.,Jl. Kramat III Gg. LISTRI I,Kwitang,NEGERI
19,20104648,SDN Paseban 01 Pg.,Jl. Kramat Sawah VI,Paseban,NEGERI
20,20100459,SDN Paseban 03 Pg.,Jl. Kramat Sawah VI,Paseban,NEGERI
21,20100460,SDN Paseban 05 Pagi,Jl. Kramat Sawah Baru,Paseban,NEGERI
22,20104649,SDN Paseban 07 Pagi,Jl. Salemba Tengah No.278 C,Paseban,NEGERI
23,20100477,SDN Paseban 09 Pg.,Jl. Salemba Tengah I/ 21,Paseban,NEGERI
24,20104651,SDN PASEBAN 11 PAGI,Jl. Salemba Tengah I/ 21,Paseban,NEGERI
25,20104652,SDN Paseban 15 Pg.,Jl. H. Murthado VIII,Paseban,NEGERI
26,20100496,SDN Paseban 18 Pg.,Jl. H. Murthado VIII No A717,Paseban,NEGERI
27,20104674,SDN Senen 03 Pg.,Jl. Abdul Rahman Saleh I/ 8,Senen,NEGERI
28,20104711,SDS Advent I Kramat,Jl. Kramat Pulo No. 16,Kramat,SWASTA
29,20104776,SDS Islam Terpadu Meranti,Jl. Kalibaru Tim. V/15,Bungur,SWASTA
30,20104769,SDS Kwitang II PSKD,Jl. Kramat IV/29,Kenari,SWASTA
31,20104787,SDS Muhammadiyah II,Jl. Kramat Raya No. 49,Kramat,SWASTA
32,20104788,SDS Muslimin,Jl. Kramat Raya No. 11,Kramat,SWASTA
33,20104792,SDS NAZARETH KUDUS,Jl. Kali Baru Timur Vi/7,BUNGUR,SWASTA
34,20104801,SDS Perg. Advent Salemba,Jl. Salemba Raya No. 47,Paseban,SWASTA
35,20104806,SDS Rumah Kita,Jl. Kenari II No. 48,Kenari,SWASTA
36,20104815,SDS Santo Fransiskus I,Jl. Kramat Raya No. 67,Kramat,SWASTA
37,20104820,SDS SINT YOSEPH,Jl. Kramat Raya No. 134,Kenari,SWASTA
38,20100384,SDS Trisula Perwari I,Jl. Salemba Tengah No. 9,Paseban,SWASTA
39,20100199,SMAN 68 JAKARTA,JL. SALEMBA RAYA 18,Kenari,NEGERI
40,20108498,SMAS ADVENT 1 JAKARTA,JL. KRAMAT PULO NO. 16,Kramat,SWASTA
41,20100175,SMAS ADVENT SALEMBA,JL. SALEMBA RAYA NO. 47,Paseban,SWASTA
42,20100489,SMAS FRANSISKUS 1 JAKARTA,JL. KRAMAT RAYA NO. 67,Kramat,SWASTA
43,20100195,SMAS MUHAMMADIYAH 1 JAKARTA,JL. KRAMAT RAYA NO. 49,Kramat,SWASTA
44,20100183,SMAS MUHAMMADIYAH 16 JAKARTA,JL. KALIBARU BARAT NO. 52D,Bungur,SWASTA
45,20100490,SMAS PSKD 1 JAKARTA,JL. DIPONEGORO NO. 80,KENARI,SWASTA
46,20100483,SMAS PSKD 3 JAKARTA,JL. KWINI I NO. 1,Senen,SWASTA
47,20100166,SMKN 34 JAKARTA,JL. KRAMAT RAYA NO. 93,Paseban,NEGERI
48,20107254,SMKS FARMASI DITKESAD,"JL. ABDUL RACHAM SALEH, NO.18",SENEN,SWASTA
49,20107255,SMKS FARMASI TUNAS BANGSA,SALEMBA TENGAH II NO.1,Paseban,SWASTA
50,20100139,SMKS FRANCISKUS 2,"JL. KRAMAT RAYA, NO.67",Senen,SWASTA
51,20100110,SMKS KATOLIK SAINT JOSEPH,JL. KRAMAT RAYA NO. 134,Kenari,SWASTA
52,20100116,SMKS MUHAMMADIYAH 10 JAKARTA,JL. KRAMAT SAWAH BARU,Senen,SWASTA
53,20100282,SMKS PSKD 1 JAKARTA,JL. Prajurit KKO Usman & Harun No. 26,Senen,SWASTA
54,20106349,SMP Advent I Jakarta,Jl. Kramat Pulo No. 16,Kramat,SWASTA
55,20106350,SMP Advent Salemba,Jl. Salemba Raya No. 47,Paseban,SWASTA
56,20106362,SMP ISLAM MERANTI JAKARTA,Jl. Kalibaru Timur V / 13-15,BUNGUR,SWASTA
57,20106368,SMP K3 BPK Penabur,Jl. Diponegoro No. 78,Kenari,SWASTA
58,20106379,SMP Muhammadiyah 13,Jl. Kali Baru Barat 52 D,Bungur,SWASTA
59,20106380,SMP Muhammadiyah 16,Jl. Kramat Sawah Baru 254,Paseban,SWASTA
60,20106381,SMP Muhammadiyah 3,Jl. Kramat Raya No. 49,Kramat,SWASTA
61,20100237,SMP Negeri 216,Jl. Salemba Raya No. 18,Kenari,NEGERI
62,20106423,SMP PSKD 1,Jl. Kwini I No. 1 Jakarta Pusat,Senen,SWASTA
63,20106435,SMP SINT JOSEPH,Jl. Kramat Raya No. 134,Kenari,SWASTA
64,20106434,SMP St. Fransiskus I,Jl. Kramat Raya No. 67,Kramat,SWASTA
65,20106439,SMP Trisula Perwari 2,Jl. Salemba Tengah No. 9,Paseban,SWASTA
66,69872299,TKLB-B TAMAN LATIHAN SANTI RAMA,Jl. Kramat VII No.13 RT.007 RW.001,Kenari,SWASTA
